Author,Publication Date,Review
donutshop,"on Oct 1, 2023","> DevOps just makes the problem worse which it is intended to solve. DevOps started from ""deploying is too hard, and the developers don't know how to run complicated shell scripts to deploy our software to release, anyone should be able to deploy it and have it scale!"". However, most companies started to cargo-cult Google and just built everything in the ""most scalable"" way, incurring tons of overhead, both in deployment friction and hardware costs, so we are back to DevOps being an almost completely separate field from software engineering, and the programmers still can't deploy software.Absolutely this. Instead of collaborating to solve problems we are wasting time on pet projects."
beezlewax,"on Oct 1, 2023","We use simple github workflows to release microservice based services and frontends on a daily basis. They're pushed through a series of dev environments for testing before being ""released"" into production by managers. It's not hard for devs at all."
pizzafeelsright,"on Oct 1, 2023","All this IT stuff fails, needs to be replaced, repaired, or adapted to a new situation.The best solutions, whatever the methodology and avenue of implementation, are made better when the builders ""live below the dam.""The incentive to build the best dam is when the party responsible must live below the dam.The best metric is customer retention. Directors of customer support need to be on the phone with escalations, not just watching metrics.  There's a leak? Take the complaints. Embrace the hate. Fix the damn dam."
hinkley,"on Oct 1, 2023",The fact that we have a “devops team” at work infuriates me. It’s enough to distract me me from how “Scrum” has destroyed Agile.
whstl,"on Oct 1, 2023","The only thing I like about the return of sysadmins and the end of the ""you build, you run it"" culture of Devops it is that I'm 100% off the hook if something dies in the middle of the night.The so-called DevOps guys are stressed out of their marbles, but when the CTO calls me 4 AM I can't say anything but ""Sorry dude, I'm not a clairvoyant. I have no permission to do shit in prod, call Ops or give me AWS access now"". He stopped calling.The fun part is Ops wants us engineers to help more, but they don't even trust (and some don't know how to run) my Terraform or CloudFormation scripts (I let them choose which), so they just read the tf/yaml and click AWS buttons manually. Often making lots of mistakes."
KaiserPro,"on Oct 1, 2023","> The fun part is Ops wants us engineers to help more, but they don't even trust (and some don't know how to run) my Terraform or CloudFormation scripts (I let them choose which), so they just read the tf/yaml and click AWS buttons manually. Often making lots of mistakes.Yeahnah, you're part of the problem.If you've not documented it properly, and more importantly, if the team are weary of prodfucking TF/CF scripts, there is a culture problem. You both need to understand how that works, if they don't have enough time, then you're understaffed, that needs to be fixed.I worked at place that was going through a really painful ops->devops->dev oncall transition. Ops still had a shit ton of power, but nobody included them, and just shouted at them when stuff went red. It took a huge culture shift, and devs sitting in ops and doing a shift or two, to sort it out."
whstl,"on Oct 1, 2023","Sorry, but how did you manage to make so many assumptions from that?Everything I need from Ops is already enumerated and specified more than well in tickets (which is required, as is par for course with the sysadmin from hell stereotype), and documented in Markdown files within my app's source code.I generate scripts for them since that's what they WANT and ASKED for several times.They literally want me and other managers to help with DevOps (Heck, I'm even AWS certified), but don't trust me and others to give access. They ask for scripts and I comply to save their time. How am I on the hook if they want me to create scripts, but some of the new hires don't know how to use Terraform/CloudFormation?> ""there is a culture problem. You both need to understand how that works, if they don't have enough time, then you're understaffed, that needs to be fixed.""The culture problem is Ops wanting to do everything and not trusting. If they don't want to ""prodfuck"", just review every script. Or perhaps test them in the staging AWS account that I pay for with my own money. Or just stop asking me to make infrastructure as code. Or suggest a fourth option instead of wasting my time and being disrespectful.I can't change other people's behavior. I can only change mine.If they are understaffed I can help, or they can hire more. Wasting my time and making me do pointless work is not the answer."
KaiserPro,"on Oct 2, 2023","> I can't change other people's behavior. I can only change mine.Ah my friend, you totally can change other people's behaviour. go on. hug an ops, sit next to them and work with them. show them a bit of love and make them feel part of the team. Think about it from their view, why don't they trust your scripts?Why dont they feel empowered to spin up a staging area? is it a skills gap? fear? or do they not feel confident enough to ask.It sounds like solving their problem will also solve yours...."
whstl,"on Oct 2, 2023","Skills gap from a chunk of the team, lack of time, lack of trust in developers, not accepting help when offered, not accepting that developers have the best interest of the company in mind, not accepting qualification of developers.I can only offer help, do what they ask and try to make their life as easy as possible... I can't hug people via Jira tickets. Yeah, they're that isolated."
hinkley,"on Oct 1, 2023",I always do a better job of writing logic when I sympathize with the victims. Some of those late night calls are devs setting ops up for failure. It was meant to close an open loop.
whstl,"on Oct 1, 2023","Yep. I'm otherwise happy to help with things in the middle of the night, but I need the means to actually diagnose and fix it.As it is, the Ops manager is probably going to have a stroke due to overwork, and it wasn't for lack of people wanting to help."
tstrimple,"on Oct 1, 2023","I think there is room for a DevOps team if they are focused on creating and maintaining the overall DevOps platform. But if they are taking tickets and setting up pipelines for individual applications, they are doing it wrong.But a team focused on making a streamlined platform with ready to adopt patterns that already account for compliance and security related concerns, they can spread DevOps adoption more effectively and consistently throughout the organization."
nunez,"on Oct 2, 2023","That was never supposed to happen, and DevOps enthusiasts still think that's a joke. Unfortunately, at some places, that was the _only_ way to get higher-up people thinking about the culture.Kind of like the idea of a scrum master, which was never supposed to be a role"
0x008,"on Oct 1, 2023","What is so horrible about it? Our devs are happy they can focus on fixing unit tests in pycharm, while others care about where the code is going."
matsemann,"on Oct 1, 2023","Because it's just a hip way of saying you have a sysadmin team. How can something or someone be ""devops"" if all the developers are in one team doing dev tasks, and the ops in a separate team doing ops stuff?"
ecshafer,"on Oct 1, 2023","A devops team is in practice typically very different than a  sysadmin team. Good sysadmins automate the hell out of everything, but it’s usually not something other people can use. Devops teams automate all of that stuff but then they also let teams build new infrastructure when they do deploys and automate that whole process, but it’s client facing. It’s development and operations, it’s a pretty good name, though I think platform or production engineering is typically a better name."
hinkley,"on Oct 1, 2023","The quality of devops scripts, from the perspective of a person who likes to write code that has to work right the first time, is about two standard deviations better than sysadmin scripts. But still of a par that would keep someone from getting promoted past a Senior Dev title.What’s worse is they can be condescending while shoveling out absolute garbage. If I’m honest that’s the part that bugs me the most."
dijit,"on Oct 1, 2023","I don't deny your experience, but my experience is that when it comes to domain specific scripts sysadmins fared much better than developers.I still see this, developers use archaic or absurd incantations in their build-scripts because they kludge something that works in bash on their machine then push it into yaml and move on, forgetting to comment, document or try to simplify the line so that it's easy to break apart later when it has to be debugged.Some of the best interpreted code I have ever seen came from a former sysadmin (it was powershell though, that comes with it's own warts of course).The issue is that we collectively decided that sysadmins should just stop existing instead of allowing it to grow properly. We forget how bad things were for developers back when we decided we didn't like sysadmins. There were companies still passing around code on a USB stick because developers didn't want to depend on SVN being down. (I am not kidding).Git was introduced 2005 and wasn't really everywhere until 2012, but 2014 sysadmins had all but been retired. This is the timeframe we talk about.Developers of that time were as bad as the sysadmins were, the problem was that the developers had time and space to grow and we judge the developers of 2012 as if they had all the tools, knowledge and incremental improvements in workflow that they have today."
ecshafer,"on Oct 1, 2023","I think part of this issue is: what is a sysadmin? That’s a pretty hard question to answer today. Maybe it was more straight forward in the 80s or 90s. But if you go to /r/sysadmin you have desktop support, help desk, office 365 admins who only use a gui, solo it guy in a small business, and also programmers, devops, cloud architects and network engineers.The sysadmins who were already automating large amounts of tasks for n Unix servers and k switches with p services, had a vastly different skill set and migrated to the more modern software defined devops SRe world no problem. But plenty of sysadmins basically could (and some still) only use a gui, and do things from trial and error. Those people might have retired or become managers, but they had a lot more issues with the transition. Which to be fair the transition happened fast and hard in some companies."
dijit,"on Oct 1, 2023","If we keep reinventing the same paradigms; isn't it a perfectly fine paradigm?It's unfortunately inherent that some people want predictable, scalable, observable, stable- and at the same time they want fast moving and many new features.I think it's not so much that dev and admin work is terribly difficult, it's more that ""a man cannot serve two masters"" and someone will be focusing on stability and someone else will be focusing on quickly deploying.Trying to do both yourself I think leads to burnout."
root_axis,"on Oct 1, 2023",N/A
medellin,"on Oct 1, 2023",The thing i have come to dislike is that in both companies i work for it lead to strange working relationships between ops/eng. anything that breaks in the deploy pipeline is now “the devops team problem” and they normally act like it’s also your fault. In the past this has meant people messaging me saying they are blocked because their dockerfile fails in CI. Then you walk through it with them and it’s also broken locally and it comes down to them pinning to something like latest tag and the image “shocker” changed. But now you  are fixing it and after you go remind everyone that you should pin your image to as strict as possible image tag. But no one cares because they can move fast and break things and when it does blame it on CI and now it’s not their problem.Anyway this is just one tiny example but the same underlying thing starts happening in all parts of the development cycle. “My deploy doesn’t work” … well your program has an error and crashes on startup but looking at the logs would be too much work. Let’s just say we are blocked and log off.As you can see this is a culture issue but it seems to be common when you have a devops team. And even more common when management (read senior management and up) think that developers “should just be developing”.Anyway thats my rant.
anotherhue,"on Oct 1, 2023","I have seen infra/devops scapegoated too much. Half the time the developers in question won't even read the error output before raising a ticket.The only solution I see is to enforce commit checks before hitting shared environments, but that comes with its own set of complaints."
tstrimple,"on Oct 1, 2023","> Half the time the developers in question won't even read the error output before raising a ticket.If they had no DevOps team to raise a ticket with, and it had to get done they would find some way to figure it out if they had the ability to modify and initiate their own pipelines. The reason I like ""you build it you run it"" is I feel like I have far more control over my own destiny. You're not having to negotiate and coordinate with a separate team through some ticketing system. Far less wasted back and forth and miscommunication. If that means you have to expand one of your teams with an additional DevOps person to foster understanding of the tooling on a team who hasn't done it before that's fine. But don't make them the DevOps person. Their goal is to enable the rest of the team to pick up these skills. Their goal should be to transition into a normal contributing member of the team working on product development because the team no longer has a need for a DevOps person."
pjmlp,"on Oct 1, 2023",Because that is the software developer/systems engineer division that already existed 20 years ago.The idea behind devops was to be a single team.
bojo,"on Oct 1, 2023","> The idea behind devops was to be a single team.I assume you are pointing out that split-teams is the insane part, in which case I agree. The philosophy was supposed to define the blurred line between developers and operations, using tooling to help facilitate the shared responsibilities where sensible and make hand-off a breeze.As you pointed out, the division existed 20 years ago, and it still exists now at many places. That lack of integration doesn't offer much improvement in relation to the past."
steve1977,"on Oct 1, 2023","That’s fine, it just has nothing to do with DevOps then. The whole point is that these are not separate teams."
stavros,"on Oct 1, 2023",It's like saying you have a self-service waiter.
Twirrim,"on Oct 1, 2023","So in other words, you made silos.  More throwing things over the wall and having it be someone else's problem.  That's fundamentally the antithesis of DevOps.People do not fix the pain they don't see, and managers doubly so.  By shifting operations off to a ""devops"" team, you just end up with developer teams that don't know about, and don't care to fix, the things that make it painful to deploy or run their code in production.
Those that have to deal with the pain rarely have any political leverage they need to even enact change.  There's zero motivation for either the developers writing the software _or their management_ to fix it.  Dev manager incentives are purely aligned with getting code and features built.To give a nice real world example, building out new regions for AWS services used to be a pain in the arse (since I left I hear some major top down initiatives have fixed that).
The service team I worked for, almost doubly so painful for region build.  Standing up an entire region was something like ~50 days of engineering time.  Not because it was especially hard, per se, but because the ops team always had to wade through piles of refactored shit that introduced new circular dependencies, or wasn't documented, or broke other aspects of any automation we could produce. (I remember one DynamoDB schema overhaul, where we did a complicated migration.  Next region build, service components wouldn't stand up because we'd used the automation to create the new table schemas that had replaced the old table schema entries, but the service code still expected to see the old schemas in the right format.  It took several months to get the dev manager to agree to engineers spending time cleaning up old schema references from their code base.)The dev manager incentives were not aligned with making it easy.  It wasn't their engineering resources being consumed, and they had features they needed to ship.  
The developers never changed the way they worked because even though they were told the issues (and even though they were, virtually to a person, great people to work with, considerate etc.), they never experienced the pain so they never thought about  those consequences of what they were doing when they were doing it.Ops manager never had any leverage, because every single time we managed to get a region launched in time as to not be an issue, and every time things were down to the wire it was clearly as a result of the ops team not building the right automation :eyeroll:, rather than that the dev teams were making some kind of brand new nightmare each time.It wasn't until the ops team had lost enough members of staff to that BS, and region build shifted on to the developers themselves, that suddenly most of the problems went away, never to appear again.  They were aware and conscious of the pain certain decisions would cause because they had felt it themselves, and they made sure not to  introduce more pain.DevOps is about making sure incentives and politics align to make things overall better.  Shoving it in to a silo is literally the complete opposite."
pdimitar,"on Oct 1, 2023","Replacing ""DevOps"" with ""Platform Engineering"" is not waving a magic wand and removing problems. The original article's main point is: ""use DevOps marketplaces"", more or less, but that comes with its own set of headaches (mainly auditing and making sure you trust them, which might easily take more time than rolling your own stuff).I fully stand behind the ""just have programmers that write internal tooling"" recommendation though. Over the course of my long career this is what has worked best almost every time, and these are the programmers who get the least amount of respect even though they have to dance and juggle on a burning rope more often than not."
nunez,"on Oct 2, 2023","2023 DevOps is awesome.Today's ""sysadmins"" are kind-of, sort-of expected to know a programming language, at least superficially. This was definitely not the case in 2015.The whole idea of Platform Engineering formally existing (I.e. platform is a product) is fantastic. There has always been lip service from IT about treating the rest of the business as customers, but the definition of ""customer"" was usually bastardized to fit whatever agenda IT execs wanted to push. Not the case (as much) anymore.Also, the idea that today's ""sysadmins"" are part of application delivery into production was extremely nascent in 2015. Most sysadmin jobs didn't touch apps with a 10-ft pole back then. This, IMO, is the greatest benefit the movement brought to bear.Shoot, even the fact that saying DevOps feels dated because it's obvious now demonstrates how far we've come.Saved the best for last. Kubernetes is hella complicated compared to 2015 ""DevOps"" tech stack (which i miss because they are simple), but provides so so so SO many benefits for free, especially if you're not in public cloud."
dijit,"on Oct 2, 2023","> Today's ""sysadmins"" are kind-of, sort-of expected to know a programming language, at least superficially. This was definitely not the case in 2015.There was a ""weird period"" in 2010-2014 where mid level sysadmins didn't know much scripting or automation. I'm not sure how that happened.Senior sysadmins always scripted, Ruby was the de-facto choice for those folks in 2010-2015; before that it was mostly perl, and after that it seems to be mostly python.Mid-level sysadmins definitely knew bash and perl in 2000-2010.I think it was the rise of calling level 3 helpdesk ""sysadmin"" that sullied the brand. But the same will happen with other disciplines. I'm sure I'll hear in a couple years about SRE's or DevOps who can't code.Heck, I bet there are already devops who can't code, who only know how to template yaml."
winternett,"on Oct 1, 2023","Since the in house server days, technology solutions have only become more and more time consuming to implement, ID & PII obsessed, and bulky (data footprint-wise). I am thankful I remember much more simple times, when apps were tiny, run on regular computers in my office, and you could symply restore from a local backup to bring a service back online.Now we have companies paying thousands of dollars a month to host a simple site or web app, because now it's all in the cloud, no matter the apps function, while hosting customers assume about 80-90 percent of responsibility for securing and maintaining their app anyway. Containerization is leveraged to add a ""backdoor"" for individual admins, but that only serves to protect infrastructure, it actually makes a customer's individual app open to vulnerability that same as running your own instance if you miss vital updates or if there is a breakdown in the supply chain. We need to stop listening to the companies that market tools and be honest with ourselves... Security needs a better model than just adding new tools and entry points to the app chain.There's gotta be a point where you evaluate things and tell yourself that there has to be a better and more affordable way than tunneling through 5 VPNs just to push updates for 8 disparate JS and PHP libraries and 5 containers. App and library updates are also far too frequent in 2023 as well... Frameworks need to ship instances with less features, and modules should be reduced to only those used and deemed most essential, reducing footprint is a key aspect lost on technological advancement, it is also a firm indicator of increased efficiency for app and library devs if you ask me.Now with zero trust, devs literally spend a lot of their daily workload logging back in and re-establishing VPN connections due to timeouts. There's got to be a point where we develop a far more simple IT solution to all of this mess. Security is still getting compromised regularly no matter what is done. The solution also won't likely involve Ai at this point in my opinion, as security and complexity are assuredly not resolved by leveraging current-state Ai tools.It's also important to note this is why PHP is still going strong, it doesn't require compilation, and is relatively easier than most other langs on learning curve to implement.I literally built my IT career on making things simpler, and in explaining complex IT issues in human language to non-technical people. There is a lot of room in my field for growth due to the rest of the industry's constant focus on jargon and over-complexity.Simpler solutions, conveyed and implemented in human language, will be king in 2024."
xnx,"on Oct 1, 2023","> Simpler solutions, conveyed and implemented in human language, will be king in 2024.I would love this to be the case, but it seems that complex and expensive systems are too lucrative to everyone involved: CTOs get to manage big budgets and bit teams, devops people get paid large salaries to justify the CTOs salary and large service budgets, etc."
winternett,"on Oct 2, 2023","Agreed, many of those huge and overly complex projects also fail and overrun implementation schedules though, and they only ultimately operate with a ton of workarounds and shortcuts. I find a lot of projects that barely match original documentation limping along, or just even after a major failure or breach in my line of work, with the customer desperate to find a patch to just keep them running after a bunch of critical data is under siege within apps.A key for me is convincing a customer to simplify goals and implement an MVP on a reliable framework, to plan versions, and to thoroughly test... Makes me a code cop, but there are reasons why these steps are in place for mission critical services, and if a customer wants to skip them and just deploy in careless ""Twitter Dev Mode"" I have them physically sign paperwork that states their accountability for the bad decision... When individual accountability is mentioned, they usually opt for the more stable & reliable methods of dev. Hah."
pojzon,"on Oct 1, 2023","DevOps is terrible because we want to have a team of fullstack expert engineers that have certs in every tech, but pay them for a single role.First there are not enough ppl with that huge landscape of knowledge.Second you would have to pay a salary of 5 ppl i.e. 500k/y to make ppl willing to spend that much time on work."
davewritescode,"on Oct 2, 2023","There are more people than you think that can slap together some YAML and a Helm chart and deploy something reasonably resilient inside a Kubernetes cluster.I've been around for the cloud migrations in every phase, what we have today with Kubernetes is miles better than the maze of Puppet and other crap we had 20 years ago."
