Author,Publication Date,Review
ibash,8 months ago,"Performance in the report is defined by how fast you can make a change to production, and how fast you can restore service.That’s fine I guess.What’s not taken into account is the time wasted on incidental complexity with devops tools.For example a highly competent engineer I know is burning hours trying to get ssl working on k8s/gcp with a specific configuration.Conceptually ssl is all straightforward, but there’s some arcane knowledge that’s been designed into k8s and gcp. Because they were designed for way more complex use cases… but they’ve also pushed out simpler tools."
zmmmmm,8 months ago,"hitting this paradox a lot with containerisation.Spent a good bit of effort building everything into a fully containerised stack, thinking once we got through the hard parts of it, everyone would be more productive and new devs would get up to speed fast. But it's not like that. We just have a whole different set of complexities, mainly at all the container boundaries where ports, volumes, user ids, file permissions, file paths etc now create issues where before they didn't.I think we probably came out with a modest win, but I'm not sure it beat out what we might have achieved with the same effort going to other productivity measures."
redserk,8 months ago,"I can’t speak to your experience, but often times I’ve run into this in development teams where there was not a strong level of systems knowledge or not a very strong understanding of exactly what an application needs to run.Perhaps one of the more amusing issues I’ve seen was someone’s surprise that a temp directory creation put the files in /tmp instead of the application’s working directory. It’s not something a lot of people would think about in development/testing I suppose.More often than not, containerization has seemed to force developers to better understand the impacts of their code on the system."
Ekaros,8 months ago,And when you choose badly the cloud platform that looked good at start. But later becomes complete pain... Always finding new amazing ways to break things... (looking at you Azure Container Instances)In the end for some light work loads could have been just thrown on VMs already running for other reasons. And it would have saved lot of time and effort...  And it could have still be deployed with some level of devops...
frabbit,8 months ago,What would you use instead of ACI?
Ekaros,8 months ago,"Not sure, in this case of workload with very low load a VM I think..."
digitalnomd,8 months ago,What I’ve found is that pure “DevOps” roles have become a way for recruiters to sell people on being the ops person without them realizing it.I once worked at a place that hired me in as a software dev working in DevOps and the position quickly became consumed by the on-call workload.The system we were managing constantly had fires that needed to be put out but we could never fix the underlying problems because someone needed to answer the page which often times was a false alarm.So we’d quickly slap on band-aids to band-aids and management gave lip service to fixing the underlying problems with on-call. And the job became about reading the Jenkins build logs because the “devs” thought that was our job. They even forgot how to build and test their own software locally in some cases…Needless to say I left pretty quickly and it made me not want to do a pure DevOps job again.
Izkata,8 months ago,"> What I’ve found is that pure “DevOps” roles have become a way for recruiters to sell people on being the ops person without them realizing it.Way waaaay back when I first heard of DevOps, it was described along the lines of ""bringing developer best practices like automation and testing to ops"".  What you're seeing could be a remnant of that."
Sparkyte,8 months ago,"It isn't dead, just companies refuse to implement DevOps philosophies because they assume it adds too much friction. When things run some and DevOps appears it isn't doing anything they fire operational engineers. Months later things go to shit because they thought they were not doing anything. Operational engineers or Site Reliability Engineers are essential because they consume toil work which would otherwise be there to distract a developer from developing. No one wants to solve pipelines and delivery methods and ensure stability and deliverability of code. Pipelines need as much continual development as a developer who makes the profitable applications."
sponaugle,8 months ago,"""The report’s authors speculate that “It may be that the ubiquity of DevOps practices has allowed developers and organizations to increase the complexity of projects they are involved in, counteracting the benefits to development velocity. In other words, DevOps practices have likely made the development velocity of complex projects comparable to simpler projects without DevOps practices.”So.. in other words - DevOps is in great health.As a nit, that would not be ""counteracting the benefits to development velocity"".  It would be increasing it for those complex use cases. It might be lowering the poorly used statistical average, but that is more of a 'you' problem from using exceptionally poor statistical practices.I always find these broad 'Something is not dead yet but dying' articles to be of very low overall content value.  They far too often depend of either highly anecdotal information, or even worse conclusions based on widespread data averages.   Even worse than that, self reported AND self selected data."
JanneVee,8 months ago,"Companies do what they always do. It isn't the first time a organization sees something trendy, say that they adopt it and just renames their old processes to with what is trendy and doesn't change one damn thing. It happened with agile and it is happening with DevOps. These poor performers are most likely doing ops in a traditional way they just adopted the vernacular of modern practices and claiming it doesn't work.The core of DevOps and agile is essentially tightening the feedback loops and using the feedback to adjust to become more efficient. ""Oh we are failing deploys"" and not figuring out why to adjust well that isn't DevOps. Not figuring out why you don't deliver what you promise isn't agile either."
saurik,8 months ago,Three days ago: https://news.ycombinator.com/item?id=40860135
fulafel,8 months ago,"I think this [1] is mistaking some post-devops developers for ""low performers"".The survey questions in slide deck p 13 (https://cdfound.lfprojects.linuxfoundation.org/wp-content/up...) could all be ""no"" for someone who deploys to Firebase or a low code platform. Even if they are doing continuous deployment.[1] ""[...] while 83% of developers are actively engaged in DevOps, there’s been a troubling increase in the proportion of low performers in deployment metrics."""
philark,8 months ago,"Senior devops here, the ultimate goal of the devops is to remove itself from the equation, when the cicd gets in a good place we switch focus to other areas like observability"
pjmlp,8 months ago,"As someone that besides being a developer, has had build engineer, systems engineer, devops, as 2nd title, this has always been a placeholder for everything else that we do besides coding activities.The guy in the team that bothers with setting up computers, physical or virtual, configuring  Jenkins, Bamboo, Team City,.., writes the RPM build scripts, and whatever else that other devs rather not do.Just like Agile, DevOps and such, they all end up being ways to have conferences, books, consulting services,..."
SebFender,8 months ago,"From an outside perspective - I've been in hundreds of meetings around different companies (medium to large size) and these efforts have been deployed in sooo many ways (and interpreted) that it becomes a tough funnel to single out.What usually works across companies are somewhat standard systems and flows. But based on what I've seen in the past 2 decades, there's a bunch of different solutions to a similar problem and most have very different ways of solving challenges..."
binkethy,8 months ago,"Docker/containers, k8s, and all the bent bloated habits eventually take a toll.Sure, it lets you ship that app with postgres,  clickhouse, redis, rabbitmq, task runners, workers, the jvm, 5 different versions of nodejs wedged in...
But is this really a good thing?Its like vacuum sealing poop in unlabeled bags and putting them into someone's refrigerator. 
Yay, surprise."
Quothling,8 months ago,"Containers and what you put in them isn't really the same thing though. I can't imagine doing deployment without containers ever again, but I'm not sure why you would put a database in one. Well except for local development. You do have a point of course, because people do put all those silly things into containers even when they don't need any of it.For me the real issue is that we still live in a world where many developers don't have anyone to hand that container off to. Even if your cloud helps you, you're likely still going to have to configure things like networking, and while I've done that myself because nobody else could, it really shouldn't have been something I did. The first time I did it, every application/service had 250 IPs despite using 3 or 4 and I'm fairly certain my vnet ate up like 50.000 IPs which I think you call a block? And as you can see, I still shouldn't ever configure network, but I'm still the best at it and nobody in management seems to want to change that."
okeuro49,8 months ago,"We have a ""DevOps"" team, which is ops."
gustavus,8 months ago,"DevOps like Agile was a beautiful idea with a coherent underlying well reasoned philosophy.DevOps like Agile was then hacked to pieces and had its corpse paraded around by sleazy consultants and idiotic management that was told ""you can save all this money on all your infrastructure people by making your developers do all the ops stuff to."" And who doesn't like saving money on those useless crusty old system administrators that don't seem to do anything except whine for ""more disk space"" if they were so smart they would've prevented that outage la da t week where the logging volume filled up.Finally the toolmakers sold the idea that DevOps was something you could buy. Just like the vendors convinced management that buy purchasing Jira you were now agile, now if you have a CI/CD pipeline you are now doing DevOps. But you still can't release without getting approval from the release committee and you can't actually provision a new host in the cloud until you have filled out the requsite approval forms, but key for some reason we uprooted our monolith and threw it on kubenetes so we are doing DevOps.It really feels like relieving the Agile cycle all over again in every detail. Just wish I could figure out the next big fad so I could get in on this money printer.PS. If you use the term DevSecOps or DevSecFinOps unironiclly your living proof the Dunning-Kruger effect."
abofh,8 months ago,"It's always been the people, not the process.  I've basically been the same sysadmin with a CS degree I've been since before I got a degree.  I've been called a developer, a sysadmin, pool boy, IT, site reliability... It's all the same job - keep things scaling, running and watch the budget.  Move the product forward by enabling the people who make the product.  Occasionally be the adult in the room who knows how the sausage is made from the metal to the frontend.People try and put a label on it to market it so they can sell it back to you.My clients rarely know what I'm specifically I'm working on because I'm a technical grazer who just monitors the world looking for interesting problems - but they continue to pay me and I believe they extract a fairly positive value from me.If I ever stuck to a single job title, they'd probably expect me to stop grazing - but that's what makes me happy and productive."
chgs,8 months ago,"To me, agile is simplyPeople over processResults over blusterFlexibility over rigidity"
OJFord,8 months ago,"Which is painfully ironic, because as soon as somewhere starts 'doing agile' it's all about the (scrum) process, bluster abounds, and everything is in pretty rigid sprints, scope changes to be avoided, etc."
datavirtue,8 months ago,"And there is still a contract wrecking nearly everything, including the business relationship."
ngc248,8 months ago,"Management just slaps agile onto everything nowadays. No time given for coming up with better solution, reducing tech debt. Most companies devolving into feature factories now. I call this methodology FRAGILE®"
pards,8 months ago,"WaterScrumFall™Funding process, requirements, planning: WaterfallDevelopment: ScrumManual testing, change approval boards, release management: WaterfallWaterfall on the outside, scrum in the middle"
bricss,8 months ago,"I call it WAGILE® aka waterfall+agile, blended with a pinch of spikes :D"
BossingAround,8 months ago,Until that director comesExpecting resultsYesterday
bregma,8 months ago,Cowboys who can shoot with both hands. Got it.
drewcoo,8 months ago,"how strange!for me it hasalways beenwhatever thehighest paid personwanted: ""Agile"""
mkl95,8 months ago,"Adopting a DevOps culture is usually very difficult at sales-driven orgs, most of which fallaciously call themselves product-driven orgs. Mostly because PMs see it as a cost rather than an investment, and their sole goal is for devs to ship an incremental ball of crap.The only times I've seen DevOps succeed was when it was supported by very senior engineers who were allowed to ignore product people's antics and implement it anyway, and when engineers keen on DevOps inflated their estimates to make room for that kind of work, particularly the initial research and yak shaving.Imo, DevOps isn't in great health because the industry isn't in great health, and most non wealthy tech companies are doing panic-driven and FOMO-driven development."
satyrnein,8 months ago,"Indeed the culture you describe does not sound healthy! In theory, Engineering does not report to Product, it is a partner with an important perspective, and can negotiate prioritizing certain projects without subterfuge.In low trust environments, all engineering-led projects that Product/""the business"" don't understand are assumed to be low value. Sometimes this is unfair, but sometimes it is warranted. Poor engineering leadership will green light all sorts of counterproductive ""silver bullet"" projects."
datavirtue,8 months ago,Winner!
amai,8 months ago,We will soon have AIOps instead.
