Author,Publication Date,Review
KaiserPro,"on Oct 1, 2023","I think the biggest issue with devops is that it originally meant ""socialising"" your sysadmins, by getting them to sit with your devs, so that shit didn't get lost because nobody thought to talk to the right team.But then it morphed into ""oh lets innovate with infrastructure"" but the innovation turned into ""lol lets just restart from scratch and ignore history"" Anybody who used early k8s can attest to how un production ready it was for the longest time. It _felt_ like progress because it required a lot of (to dev eyes) hidden magic to make it work.Now, we are back with sysadmins, but they are called SREs. They provide a platform, which devs talk to to deploy stuff.Basically we're back where we were in 2015, just with more yaml.The good things that have come out of devops has been the dashboarding and metrics tools. Its just a shame that everything else touched by it appears to be an infinite source of busy work (looking at you kubernetes)(before anyone asks, I'm an SRE at a FAANG.)"
lamontcg,"on Oct 2, 2023","DevOps was originally about moving ops into dev teams.  At Amazon they just gave devs pagers.  Devs hated that.  The SRE role seems to have taken over the app-facing side of what system engineers did being an interface between an app and the hardware.  A lot of what I see SREs doing is things like app metrics and SLAs which were not what system engineers really did.  And the SRE role has been pushed around from being embedded in dev teams, to being their own teams that managed apps to being a centralized DevOps team that looks an awful lot like the old silo'd split between Dev and Ops.  I don't know where the actual system engineers went, they probably run Kubernetes clusters at FAANGs and have SRE titles these days."
notanormalnerd,"on Oct 1, 2023","So you mean, DevOps has made Sysadmins more service oriented and now instead of having their pets and being in overprotective silos, they actually provide best practices and proper platforms for the poeple developing the software?"
sisve,"on Oct 1, 2023","Im not sure how former sysadmins feel about it, but from a dev standpoint, DevOps worked great for us. Making a clean cut on a plattform. Was my app down, I got message/called. If the platform was down it was the Infrastructure team / PaaS provider that needed to fix it.In the old days we had so few deploys and a hotfix was something that was extraordinary. I actually had a board of something in another country approving that we where allowed to deploy. They knew nothing about the application.."
tryauuum,"on Oct 1, 2023","god do I hate the ""pet"" analogyyes this server is special to me. No, I cannot move workloads somewhere else and shoot the server in the head. Because customers are running GPU workloads there, I cannot transparently migrate them"
fragmede,"on Oct 2, 2023","How does the analogy falling flat for you? GPUs are interchangable resources; an H100 is just like any other H100, even if you can't take a snapshot of an intermediate state from one and load it onto another and resume."
tryauuum,"on Oct 3, 2023","I thought about it and I don't hate the analogy. Although usually I'm very against comparing IT stuff with physical stuff because it tends to produce pointless conversations.What I hate is the attitude of ""treating your server is a pet is wrong, you should be able to kill it and replace any time"". I feel like people who say it never run anything more complex than an HTTP API."
fragmede,"on Oct 4, 2023","Ah yeah I totally agree. Having pets is fine until it isn't. A single-digit handful is fine. 1,000 bespoke pets, way above Dunbar's number, isn't. Where exactly you run out of mental headroom and should convert is up to you; the point is that there is one and converting over should be planned for in the North Star roadmap of future development.My (Raspberry Pi) home server is very much a pet, but I'm never going to productionize that thing, so I'm totally fine with it being a pet, despite the practice at work of having no pets, all cattle."
KaiserPro,"on Oct 1, 2023","thats how it _should_ be.The place it worked the best was where a team of sysadmins were split up and embedded with each dev team. each devop would then rotate onto another team every 6 months or so. This meant that _we_ had to document our shit for the next devop, but also helped eliminate key person dependencies.We would then have a weekly offsite where we'd bitch and moan about our teams and conspire to make things better."
nunez,"on Oct 2, 2023","...and all of that is before looking at the tools in the CNCF diagram.Maybe this is ""old man yells at cloud"" me but I miss 2015 DevOps.If you knew Terraform, Ansible/Chef, a monitoring tool, a cloud (usually AWS) and a programming language (usually Python), you were all set and could still be idiomatically/culturally DevOps.And I say that as someone that knows Kubernetes very well"
tester756,"on Oct 1, 2023",<conspiracy theory>Admins wanted to increase their $$ and started calling themselves DevOpsAnd developed some automation to justify that</conspiracy theory>
fragmede,"on Oct 2, 2023","I know a few old school sysadmins who got left behind because they couldn't upskill to DevOps and consequently lost out on $$, others who were fired after moving everything off prem to AWS because the company no longer needed them. You understand that your theory is a ""conspiracy theory"", so why even say it? how does that add to the discussion?"
KaiserPro,"on Oct 1, 2023","Shhhh, the union will get you.Although sadly in most cases the automation was harder than the original service to look after."
mattgreenrocks,"on Oct 1, 2023","More a general question, but I’ve gotten pings in the past to be an SRE at a FAANG despite not doing much cloud stuff. Is it the type of role people take for a tour of duty and then transfer out of?I imagine there are SREs who enjoy it and stay there, but curious why they’d invite someone heavy on the dev side to interview."
dijit,"on Oct 1, 2023","Depends on the FAANG, Google famously throws devs at ops problems.Ironically they realised this wasn't a good idea in exclusivity, so now they hire two disciplines: SRE-SWE and SRE-SYS.SRE-SYS is as you would expect, pretty standard sysadmin knowledge from 2005 (IE; not helpdesk sysadmin, some scripting knowledge, heavy OS knowledge, heavy debugging knowledge).SRE-SWE is much more programmer heavy with a light touch on OS fundamentals (based on what I consider important for OS knowledge FWIW)."
KaiserPro,"on Oct 1, 2023","depends on the company and department.the downsides of SRE is that you tend to be super hyper specialised in something thats only really of any sense to that department inside a company.Moreover, you're dealing with real steel machines, and amounts of data that are prohibitorily expensive to just start again with. (the joy of AWS is that most of the times you can delete it all and spin it up again, often side by side)also, some SREs are really specialised software devs, others like me are sysadmins who'd been swept by the current into SRE roles.My company SREs are not like google's, where they are rock stars swanning about doing one line fixes that make everything .48% more reliable. We are computer nurses making sure that the wards of systems we look after aren't wiped out because a doctor forgot to wash their hands after taking a poo.However, they both require the same skills: murder mystery and the ability to dive super deep into the stack, go from python->c->assembly. or service->VFS->cache->network->time weirdnessAlso it could just be copy pasting service defs and making dashboards, then pinging devs saying ""shits on fire yo"""
llama052,"on Oct 1, 2023","Maybe in FAANG it's ""back like we are in 2015"" but the tools that have been brought into the mainstream like Kubernetes, automation tools and such have had a great impact across many small to large sized organizations.It's done a great job to enforce consistency and immutable infrastructure in a way that is more approachable for most when you get past the scale of a few resources.I've seen start ups write their on bash tooling, watch it devolve into some opaque thing that no one knows how it works or what it does. I've seen platform teams devolve into managing VM updates by hand, babysitting operating systems of every application deployed because it's treated as a long living pet, and it gets worse when team leads move on and then someone else comes in and half bakes their own flavor of change. Even better when networking gets involved, load balancing with HA where people roll their own solution. On top of that is the certificate story and how that gets managed. Don't even start with RBAC from a platform perspective, it's a nightmare. The toil filled platform days should be behind us. Plenty of companies are slow to evolve and you can find a lot of pain.Perhaps I've had bad luck in my history of being a network engineer, infrastructure engineer, and an SRE. The one big benefit to these tools that are coming out is it can give some sort of standardization and it's giving you a ton of power in abstraction so that platform teams aren't micromanaging things that are just sorted for you.Something like Kubernetes gives you load balancing, high availability, RBAC, networking and routing, resource management, node draining and rotations, auto scaling. Sure it's managed in yaml manifests, but it's doing a lot of lifting. I won't say that the abstraction can't bite you, you still need to understand the core concepts of things. However people should be understanding those concepts regardless.The amount of work that takes for a small team at a startup that needs to scale services is immense without it. Right now I'm working with a 3 man platform team and we are running over 200 services in multiple regions, multiple database technologies and analytics stacks, we auto scale aggressively and we serve over a billion requests and terabytes of traffic a month with over 99.99% of uptime. We also deal with operations, security and every other hat that someone wants to throw our way. The metrics solutions to come out of this are also such a huge win, I remember the days of Nagios, Zabbix, SolarWinds etc. They were mostly static graphs showing you snapshots of what happens at a very high level, now we have metrics for everything and you can feed that into anything to self-remediate or escalate. I absolutely love it and can't wait to see it evolve more!The previous iteration of platform at this company was all self-managed VMs with the old school sysadmin mindset. They were managing hundreds of VMs by hand or using some light ansible that was retrofitted to work with pre-existing machines, we were using corporate F5 load balancers and VMware which are immediately out of date the moment you deploy them. Some older sysadmins were legitimately afraid of rebooting servers because they were afraid they wouldn't come back. Some machines had over 900 days of uptime because they just couldn't keep up with the toil. Also this creates a wall between the platform and developers because it turns into a hand-off process where developers throw code over and the platform team has to implement some server and load balance logic, let alone meeting SLO/SLI criteria. Sadly, that's not uncommon to any industry. This team had 15+ people and had trouble keeping up let alone deploy and innovate. Outages in this mode are unavoidable, and pulling away from that old school mindset and starting over is VERY hard.I'm sure a lot of that can be contributed to bad management and bad hires, however from my perspective using tooling and standardization will only help you build a platform that can actually grow. Making that predictable and easy to digest is important, and so is understanding the details underneath. I just know I will never want to go back to 2015 or anytime before. I'll babysit kubernetes node issues or upgrade woes all day if that's what it takes (not that I need to).Granted this isn't the case at FAANG, they've got the brain power to build a consistent platform regardless. Everyone below that though benefits greatly."
KaiserPro,"on Oct 2, 2023",">  but the tools that have been brought into the mainstream like Kubernetesunless you are running real steel, kubernetes is at best a complication layer over the underlying cloud tools. In 2018 me and my team built a real time, ML-based processing API. It was hugely scalable, optimised for speed, price and uptime.At no point did we use need to use kubernetes. Not only would that have eaten most of our innovation budget, all it would have done is add latency and driven up the money we spent on inter VPC transfers.> I remember the days of Nagios, Zabbix, SolarWinds etcSo do I, they were recognised as shit even in 2015. $work allowed me to lead the migration away from them and by then we were half way through replacing most of splunk with graphite/grafana based metrics instead. The rest of the alerting was mostly handled by a custom inhouse /__status end point parser.> The previous iteration of platform at this company was all self-managed VMs with the old school sysadmin mindset. They were managing hundreds of VMs by hand or using some light ansible that was retrofitted to work with pre-existing machines, we were using corporate F5 load balancers and VMware which are immediately out of date the moment you deploy them.That, again, is just bad sysadmin. Unless you have complete control over your stack with ansible, then its not ansible, its just sparkling bash script.I worked at a VFX company that deployed to all real machines for virtually everything. They used a GNU configuration system that was older than SSH (I can't remember what its called, it used to use rsh, that's how old it was.) All the machines were fungible, We could replace a file server at the drop of a hat (the only limit was how fast we could copy 160tbs over 2x10gig nics) Most of the place ran on perl, in one git repo for just configuration. OS updates were applied weekly, and we pushed system changes daily. This was in 2013.salt made all of that easier, especially as we had way too many hosts to sensibly run ansible at the time(I think we worked out it would take >1day to run a basic role).They had automated it to the point that you could plug in an unconfigured blade host, turn it on, and within 30 minutes, the bios was updated, networking configured and each blade was starting to be installed.Automation is an attitude. You can either invent new tools to solve hypothetical problems badly (k8s supposedly is high scale, but cant practically get above 1k hosts, its also balls deep in ipv4 ), or actually use/create tools to solve the problems you have now."
mschuster91,"on Oct 1, 2023","Yuck, Portainer... when I read that I get nightmares.The problem is: when you give developers access to Kubernetes, to ECS, to Portainer, to whatever they. will. not. care. about literally anything. You'll find a hotpot of cobbled together Dockerfiles with zero provenance, with base images pinned to stuff years old, and completely inefficient layer ordering. Pipelines won't use caching or parallelism (okay, sometimes because they use Maven which is a clusterfuck on its own).Software developers are developers, 90%+ will never have heard of how Linux works below the hood, how Docker actually works, they'll just copy and paste together stuff from Stackoverflow without even attempting to understand how it works.And I don't even blame them. I can't, I don't want and I won't.Companies, it's time to stop loading stuff onto your developers that they don't have to (have) any clue. JFC."
ElectricalUnion,"on Oct 1, 2023","The developers are literally paid to do the least amount of work that could possibly do towards delivering some abstract MVP ""this sprint"".Actually making something that is simple and maintainable is the 7th or 8th priority of business, if it is a priority at all.Artificial ""obstacles"" to delivering the artifacts in time in fact, wanted, a sort of corporation Deus ex machina, externalities to explain why they did not meet delivery deadlines last time.Incentives are not aligned. Things will remain broken until incentives are aligned."
shrimp_emoji,"on Oct 1, 2023",And some devs do learn how Linux works but don't want to waste their time memorizing how shitty $DEVOPS_PRODUCT that'll be replaced in two years works. :D
mschuster91,"on Oct 1, 2023","Indeed. Which is why I waited for three years to take on Docker, and two more for Kubernetes after I got burned with DC/OS, and why I entirely left the NodeJS/frontend ecosystem. I'm too old to act as the ripener for bananaware any more, and I'm pretty sick of companies exploiting other companies  or, even worse, individual developers to act as their free QA department."
pjmlp,"on Oct 2, 2023","As someone that knows how several UNIX variants have worked since I used Xenix in 1993, those devs usually learn how a specific Linux distribution works, place them in another work, and they will be hunting for configuration files, init systems, daemons and what not.Same applies to me, ""knowing"" GNU/Linux since Slackware 2.0."
dmart,"on Oct 1, 2023","To me, DevOps culture just feels like a way for businesses to save money by not staffing a dedicated infrastructure team and pushing all those responsibilities onto application developers.The amount of time I've spent fiddling with Terraform, Ansible, Kubernetes manifests, Helm charts, Jenkins configuration, GitHub Actions configuration, AWS IAM, and so on over the past few years is absurd, probably more than the time I've spent writing actual application code."
booi,"on Oct 1, 2023",What now? If you’re spending that much time on devops I feel like you’re doing it wrong. I do eng (team of 7) and devops (only me) and I feel like I spend about 5% of my time on devops.These tools have made deploying production quality infrastructure take a fraction of the time. These environments are basically already preaudited and verified. They’re also just much higher quality in general. It’s quite typical for different projects to share infrastructure in traditionally deployed systems but with devops we can have much better isolation with less deployment time.
firesteelrain,"on Oct 1, 2023",Who patches your VMs? Installs Antivirus.. installs vulnerability protection.. defines your resource groups.. virtual networks.. sets up your Azure subscriptions.. performs billing management.. etc?I hope its not you. The whole idea was that there is a platform team responsible for providing a service or better yet the CSP does this for you and then you just have to architect as a platform team the things I listed above. It does not happen via magic. But the CSP platforms makes it certainly easier to provide a pre-audited version of the OS and tools.You should be able to self-service yourself within say a developer like portal as part of an IDP as described here. Not figure out ALL of the infra yourself.
report-to-trees,"on Oct 1, 2023",One of the things that bothers me the most with the cooperate software development rat race is how many problems are being solved over and over again. Every company is staffing their own devops teams to build their own abstractions over these technologies so app developers don't have to worry about it. I personally know multiple devs who basically move from company to company reimplementing the same devops tools at each one.It all just feels like a collosal waste of energy and collective resources.
pdimitar,"on Oct 1, 2023","> To me, DevOps culture just feels like a way for businesses to save money by not staffing a dedicated infrastructure team and pushing all those responsibilities onto application developers.Yeah, because that's exactly what it is."
satvikpendem,"on Oct 1, 2023","We have separate devops teams, though, so I do zero fiddling with all those technologies."
politelemon,"on Oct 1, 2023","If the DevOps ""culture shift"" didn't solve problems for you, this will not either. You will still have similar problems, now abstracted away into a different team that operate at their own pace. They will also be overbooked, like before, with the difference that now they are serving multiple teams you didn't have to contend with before. They will not share your incentives or priorities for specific features. Their time will still not be taken into account during product planning.Both the DevOps move, and its current issues, as well as platform engineering are organisational problems. Your organisation needs to be set up around this in order for it to succeed.Notice that the article paints platform engineering with the same utopia like brush strokes that once painted ""DevOps as a culture"", only to be mangled in its handling and blamed for the problems that it brought about."
campbel,"on Oct 1, 2023","The creation of DevOps teams instead of SRE / Platform seems pretty common and I think originates from ignorant engineering leaders and poorly defined roles and responsibilities. You want to leverage the expertise of the folks who focus on cloud infrastructure, but you can't move the responsibility of operations away from the application teams without seriously compromising incentives that effect quality, throughput and reliability."
BeefySwain,"on Oct 1, 2023","Can you expand on what you mean by this? Specifically: ""you can't move the responsibility of operations away from the application teams without seriously compromising incentives that effect quality, throughput and reliability"""
groestl,"on Oct 1, 2023",I guess it's: You change the way you think about those metrics if you're the one being called at 2AM Saturday night.
Etheryte,"on Oct 1, 2023","Your application architecture dictates how it should be deployed and the other way around, if you try to decouple the two you're bound to run into issues. Depending on what your application does, high throughput with some loss might be ideal, or you might need at least once delivery instead while sacrificing throughput, or any other dynamic. If your deployment is done by an entirely different team from the team that builds the product itself you have little hope of predictable positive outcomes without a lot of pain."
jen20,"on Oct 1, 2023","To be more blunt about it: if the person writing the code is not the one on the pager at 3am, they have no serious incentive to make it correct or resilient.This is why ""you write it, you run it"" is so important - the most reliable software is the software never written, but if something must be written, it's important that all incentives are aligned for it to work right.Of course, this is only at the operational end - lack of incentive alignment is rampant in ""product"" organisations too."
mschuster91,"on Oct 1, 2023","> To be more blunt about it: if the person writing the code is not the one on the pager at 3am, they have no serious incentive to make it correct or resilient.The problem is in 99% not that the developers don't want to do correct code. The problem is that product/project management doesn't allocate the time and budget for clean development practices, proper QA, and refactoring because their metrics are revenue, releases/timeframe, or similarly useless/unsustainable."
whstl,"on Oct 1, 2023","Can 100% confirm. Last place that had that pager duty tried to throw this shit on me. Product Owner was constantly denying time to build monitoring.Everything in this loop was misaligned and rigged against devs. The only power I had as was to quit.Now that this is over and traditional Ops is back and called SRE, it is Product Owners, Support, Managers, Developers and CTOs screaming all at once at their team. Let's see where this will lead us."
convolvatron,"on Oct 1, 2023","as a software developer, every place I've tried to work that's ""you write it, you run it"" turns into me just spending all my time running the code as it already existed, with actually trying to improve reliability as kind of a bonus 10% task that no one ever talks about or asks after."
ElectricalUnion,"on Oct 1, 2023","It always depends on aligned incentives, for some very specific lines of work and very specific people, they will totally intentionally upkeep known bad software without improving it too much because it's somewhat a guarantee of very profitable overtime pay."
formercoder,"on Oct 1, 2023",SRE needs authority to hand back the pagers. That’s a key aspect.
Pannoniae,"on Oct 1, 2023","DevOps just makes the problem worse which it is intended to solve. DevOps started from ""deploying is too hard, and the developers don't know how to run complicated shell scripts to deploy our software to release, anyone should be able to deploy it and have it scale!"". However, most companies started to cargo-cult Google and just built everything in the ""most scalable"" way, incurring tons of overhead, both in deployment friction and hardware costs, so we are back to DevOps being an almost completely separate field from software engineering, and the programmers still can't deploy software."
ecshafer,"on Oct 1, 2023","Devops absolutely fixed a lot of issues. Going from manually merged SVN branches on a quarterly release monolith to a ""click and release application"" is a huge saver in developer time and pain."
theduder99,"on Oct 1, 2023",that's great for you.  at my company devops are still doing monthly releases and unable to deploy single microservices because all the services are too interconnected.
llama052,"on Oct 1, 2023","That doesn't sound like a devops problem, but a culture one."
