URL,Author,Author Description,Publication Date,Votes,Review
https://www.quora.com/Why-is-Agile-software-development-not-suitable-for-a-large-scale-project,Stacy,Knows English,2021,0,"The required time is calculated based on the fact that the development speed is always constant. But, as we already understood, it is not. Therefore, even if everything else is done correctly, the time error can reach 100 percent or more when the planned amount of work is large enough."
https://www.quora.com/Why-is-Agile-software-development-not-suitable-for-a-large-scale-project,Christopher Jefferson,Knows English,2021,0,"Possibly the biggest reason why agile projects fail in large enterprises is the fact that people just don't have experience with the methodology or how to integrate it. However, without the adequate knowledge, chances of failure in these cases are much higher.
#panlearn"
https://www.quora.com/Why-is-Agile-software-development-not-suitable-for-a-large-scale-project,Miles Fidelman,"Systems Architect, Entrepreneur, and Policy Wonk",2022,1,"Agile Considered Harmful
I've been inundated with one too many articles/blogs/emails/..
https://www.linkedin.com/pulse/agile-considered-harmful-miles-fidelman/"
https://www.quora.com/Why-is-Agile-software-development-not-suitable-for-a-large-scale-project,Anuj Shrivastava,Project Manager at Knorr-Bremse (2014–present),2021,2,"Thats a myth. Agile can be used for any project but offcourse there are challenges with the team
Agile development can work miracles not just for the SW, but for the HW, manufacturing or any type of the project
There is something called as Scaling of Scrum where different teams work together. The impedements are scaled to the highest level daily if its not solved.
Let me explain this in simple way
Eg: You are manufactuing a car. You will have smaller Scrum teams working on individual components or to start with you can have teams baseds
Each team will have a Scrum Master and they will meet in SoS (Scrum of Scrums) and similarly will the POs . PO cycle will help to align the most important valuable MVP to be priortise, not just at team level and also at organisational level
Similarly SM cycle will solve the impedements, cross team dependecies or waiting for each other
Finally there can be an EAT (Executive action team) who can present the status of project daily based on the Scrum cycles and development in just 5 min to the Project manager and MD/CEO or Sterring commitee of the Project who have to now support the team
Usually the problem today is most of the teams work as a single teams and not cooridinate or connect each other. Also the mails and reporting for what so ever reasons are just based on fromats and non sense data.
“Scaling Scrum and Cross functional team integration” is the key to make Agile development sucessful irrespective of the type of industry"
https://www.quora.com/Why-is-Agile-software-development-not-suitable-for-a-large-scale-project,Don Taylor,"B.S. in Computer Science & Mathematics, The Ohio State University",2021,1,"Who said it isn’t? The onus is on them to explain why. Agile is simply a means for delivering the most value for your project’s budget.
What we really need to look at is why is Agile not suitable for really small projects? And that’s because any project management methodology is too much overhead to be tolerated for such projects. As it is, most projects funded by business are significantly larger than the projects you were assigned at University so some form of project management is needed. As I said, Agile is simply a means for delivering the most value for your project’s budget."
https://www.quora.com/Why-is-Agile-software-development-not-suitable-for-a-large-scale-project,Anup Dash,Digital Transformation in Customer Experience,2021,101,"I may disagree with your opinion that
“Agile software development not suitable for a large scale project”.
I would say this in the following in the support:
SCRUM is used widely across every kind of industry as well as for projects of different scale.
There is no restrictions on the adaptation of the framework. Its purely driven by the organizational culture and implementation methodology.
Scrum has been used to develop software, hardware, embedded software, networks of interacting function, autonomous vehicles, schools, government, marketing, managing the operation of organizations and almost everything we use in our daily lives, as individuals and societies.
As technology, market, and environmental complexities and their interactions have rapidly increased, Scrum’s utility in dealing with complexity is proven daily. Scrum proved especially effective in iterative and incremental knowledge transfer. Scrum is now widely used for products, services, and the management of the parent organization.   
Scrum is:
Lightweight
Simple to understand
Difficult to master
Thanks for reading my answer and hope this was helpful."
