Author,Publication Date,Review
vesinisa,"on Oct 29, 2022","SAFe not only keeps middle managers employed and feeling important but also forces lots of unnecessary pencil pusher type work on the engineers and designers. It's a strain on all parts of the organization that are forced to use it.This is why most companies will abandon SAFe after a couple of years, like the case studies show. I have personally left one employer (a bank) because SAFe made the job unbearable.Both this company and their larger competitor abandoned SAFe after a couple of years. I now categorically ignore any gigs and openings at companies using SAFe - it's a glowing red flag to me."
teeray,"on Oct 30, 2022","I have also left an employer with MBAs that continually tried to find and mandate the One True Way of building software. I noped out when I found myself in multiple status meetings every day repeating myself to different middle managers (and having to update a Slack status channel as well). Spoiler: they adopted SAFe after I left, which told me everything I needed to know about SAFe without having to experience it firsthand."
chris_nielsen,"on Oct 30, 2022","When I read it, I see a devastating critique of SAFe from every big name I trust in the Agile space. I would never recommend SAFe. But no-one is asking me…How would a potential customer of SAFe see it?Right now somewhere in the world there is probably a C level exec of a large org reading a powerpoint about how transformative and agile SAFe is. They’re probably in their mid fifties and have never worked in tech before. They know agile is good, but any large IT project is risky.What would they see if they read this? Would it mean anything to them? Or would they see a bunch names they don’t recognise, and a list of failed IT projects blaming SAFe."
29athrowaway,"on Oct 29, 2022","I like this take on SAFe. Steve Denning has great talks about what agile is, and what it is not.https://www.forbes.com/sites/stevedenning/2019/05/23/underst...The SAFe training is predominantly a bunch of pointless games, marketing, and baseless claims. Leaving all that aside, it's just fake agile."
synu,"on Oct 29, 2022",It’s agile for companies that absolutely do not want to adopt agile but want to be able to tell their (prospective) employees that they have.
29athrowaway,"on Oct 29, 2022",That is a nice way to describe it.SAFe puts a bunch of layers between you and the customer.Agile is about removing layers between you and the customer.
ResearchCode,"on Oct 29, 2022","Are employees looking for ""agile"" companies? Seems more like a red flag for micromanagement nowadays."
synu,"on Oct 29, 2022","My personal experience is that, while you’re absolutely right for startups, large multinationals and companies that don’t see themselves as necessarily tech-first still use it as a selling point.I don’t know if it is effective to do so or not, but I do see it highlighted on job ads/recruiting landing pages."
29athrowaway,"on Oct 31, 2022",Better to be micromanaged by 1 person than 10.
retrocryptid,"on Oct 29, 2022","This seems a bit of a hit piece, but it seems like a safe target as at least half the people I know seem to hold it (SAFe) in disdain.  I've consulted for organizations that started using it and have a mostly negative opinion.  Organizations that are in near complete disarray may find it useful; but then again, they might also find a return to old-school waterfall useful.  Where I've seen SAFe not work so well is organizations that are doing reasonably well with planning, but have some deficiencies or some corners of the organization that aren't doing too well.Traditional Agile doesn't scale well above the team level (not that it's bad, it's just that benefits from its processes don't seem to be focused on that level of the organization.)  Scrum of Scrums is rarely executed well and Lean and XP don't really describe practices for that echelon.  (I'll have to re-read my Kanban books and see if it addresses it.)My take on SAFe is that it rigidly adds dependencies between teams, even if such dependencies are counter-productive.  But like the manager who uses the daily standup as a status meeting, it seems like it's serving the ""bean counters"" instead of the people doing the work."
brightball,"on Oct 29, 2022","I’m going to summarize my earlier comment with this:SAFe with Scrum teams (how instructors are taught SAFe) merely adds more ceremonial meetings and sucks for everyone.SAFe with Kanban teams trades the scrum ceremony for less frequent SAFe ceremony and is a much better experience for developers.SAFe corporate needs to change the way they teach it to address the clearly visible issues coming from the way they currently teach it, based on the comments here."
csours,"on Oct 29, 2022","SAFe is not about software development or planning. SAFe is about funding software development in a cost center. I haven't seen anyone address how to do the accounting for software development for a large organization, where that software is not being sold for money."
roguecoder,"on Oct 29, 2022","You are absolutely right about the short-sighted problems created by incompetent finance models.I've seen two successful approaches in practice. The first is vertically integrated companies using easily-measured labor-saving techniques like ML to justify the infrastructure costs required to support those innovations. And the second is places where workers have the institutional power to advocate for investment in the tools they have to use.It seems to me that there should be an effective strategy where we treat software as capital spending that gets appropriately depreciated, but mostly what I see is finance departments trying to micro-manage development and in the process costing their company a lot of money."
ethbr0,"on Oct 29, 2022","Internal billing + discretionary ""keep the lights on"" budgeting?It has its flaws, but it's not the worst approach."
mindwok,"on Oct 29, 2022","I view the implementation of SAfe anywhere as a huge red flag. To me it suggests that the decision makers read about Agile and what it proposes and decided that for whatever reason they don’t want it, in its unfettered form it scares them, or they don’t understand how to adopt it. As someone who prefers working in Agile workplaces, that tells me all I need to know."
JamesSwift,"on Oct 30, 2022","My experience in an org that introduced SAFe during my time there, was that it was actually a misguided bottom-up introduction. A couple teams went agile and found it really effective then thought ""if it was this effective for 1 team just imagine if we scaled it up to everyone!"". Spoiler: I will likely never work for another SAFe org again."
oneplane,"on Oct 29, 2022","Seems to me that SAFe like so many business ideas only exists because companies that work well without it may still work well despite having to use SAFe. Companies that don't function well are not magically turn into well-functioning companies because someone threw a book at it. When you can restructure a company from not-working to working order, it's not SAFe that did it, but someone with enough time and energy. At that point it doesn't matter if SAFe was involved or not, because that's just an idle wheel coming along for the ride."
heynowheynow,"on Oct 29, 2022","When consultants suggest a ""new"" fad, they're all about charging money to help businesses adopt that fad to avoid FOMO. Predictably, there will be a new fad next year and the year after that. Waterfall: elevator control systems, agile: expense reports UI, and apply a blend to things in between."
doctor_eval,"on Oct 29, 2022","100% agree. I worked at a large telco where this happened. Brand-name consulting company “changed methodology” half way through the project and charged the customer for it.I couldn’t believe it. But then again, we were quite literally the only team that delivered a product, so naturally we were seen as a threat and our contract was cancelled.True story."
heynowheynow,"on Nov 6, 2022","Those who can't tend to hurl negativity and sabotage at those who do.Or people who are too dumb or lazy to try language X or approach Y (minus fads) tend to reiterate how wonderful their stale way and obsolescence are.There are people at my work (MAANG) who say Rust is too ""esoteric"" and ""impractical"" despite the whole company and industry moving that way, but they're comfortable in just now finding Go and being religious about it, maybe 8 years late to the party that's now over because it's ""worse is better"" shit in the long term. I'm looking around because I think my team is doomed since it lacks coherent leadership (the lead was playing with VR and skipped their own conference), it's full of ""senior"" people who lack professional career development goals and are uninterested in leveling, they're fine with ignoring software craftsmanship and tech debt, and they don't interact with me with any regularity. I can't get anything done or propose any ideas because the lead looks at me like Tucker Carlson before I can finish a sentence. They don't include me on anything, so I don't know why I'm there."
mrweasel,"on Oct 29, 2022","I've never worked in an organisation that used SAFe, but to be honest I've never worked for one that used SCRUM either. The only semi-structured method I've ever been part of has been ""SCRUM BUT"".What I find weird about both SCRUM and now SAFe is that pretty much every single agile expert I've read articles and blog post from dislikes it. My take away is that the agile purist, if you can call them that, are focus on delivering high quality software and user satisfaction, that's the focus, that's the goal. SCRUM and perhaps now SAFe (presumptuous acronym btw) seem to be focused on managing software deliveries in larger organisations.As some one who studies software engineering and process management 18 years ago, I can't say that time has made me think that things have improved much over time. I am especially skeptical of processes that comes with certifications and titles. The original agile manifesto is beautiful in that it's something we can all do. There's are no training, no certification, no corporate backer. Its principles, and you can either agree or disagree, is something the team can reflect and meditate on how to best incorporate the ideas into their work.Overall, more and more I start to think that PHK was right in his talk ""Entirely Predictable Failures"" in 2012[1]. It's snake oil, almost all of it.[1] https://www.infoq.com/presentations/Predictable-Failures/ (At around 24:30 and a few minutes from there)."
29athrowaway,"on Oct 29, 2022",Scrum is not an acronym.
rileyphone,"on Oct 29, 2022","I strongly agree with this, but you need some more editing, especially to convince the leadership types that keep making this mistake."
cpeterso,"on Oct 29, 2022","And if you’re going to say “Don’tdo SAFe, you sure suggest some alternatives."
nvr219,"on Oct 29, 2022",Agreed.  The decision makers at my company would not read this.
mkw2000,"on Oct 29, 2022","I had a recruiter mention to me that the company is all about SAFe and I should express my interest and enthusiasm for it during my interview.  I looked it up, saw a diagram describing the process that actually made me burst out laughing and ran far away from said company."
brightball,"on Oct 29, 2022","I'm a SAFe certified SPC and RTE. Also a programmer with 20+ years of experience.IMO the only real issue with SAFe is that the quality of trainers have probably become diluted. If you have a SAFe instructor without a programming background to go along with it who can understand how all of the pieces involved will affect the people and the process, you're going to end up with pure by-the-book rigid implementer...because they probably don't know any better.I was drawn to SAFe after posting a lot of venting thoughts on my blog, that got picked up here and somebody on this forum recommended a fantastic book to me. The Principles of Product Development Flow: 2nd Generation Lean Product Development by Donald Reinertsen.https://news.ycombinator.com/item?id=17154355This book is not rigid, nor are the principles within it. I used those principles to very successfully run a development group, but I was failing at consistently involving the business side of the house effectively. I looked around for something more formal that was based on his work and I found SAFe. Going through the training, it's about 80% based on that book. You'll recognize all of the underlying principles.But I took so many classes on it because I wanted to make sure I understood SAFe well enough to know the goals of it's structures so that I knew how to adapt effectively. I don't think a lot of SAFe instructors do that.So here's what you need to know about SAFe. They flat out tell you, you are NOT trying to fit the organization into this structure. You're trying to see how the principles of this structure can benefit your organization.If you want an effectively summed up list of the keys of SAFe from everything I've learned it's this:1. Continuous Delivery & Deployment are the primary goals of this structure. There is a huge focus on development pipeline automation and all of the efficiencies that come from it. I have no idea why anyone would think otherwise based on comments in that link, because it's absolutely core to the entire process.2. Prioritization without emotion. SAFe prescribes a formula based approach to prioritization that is essentially a dressed up Return on Investment formula called Weighted Shorted Job First. It recommends structures to get a lot of representatives from the business side of the house to go through and apply relative weights to 3 different factors to establish a Value metric called Cost of Delay and then counts on the technical side of the house to estimate the workload. This helps you prioritize in a way that factors in Opportunity Cost. You have X amount of developer time, if you spend it on this you can't spend it on that.This process is FANTASTIC for everyone involved except the person at the company who is used to getting things prioritized by yelling the loudest. On the business side, everybody has a clear place to have a voice in the company priorities. On the dev side, you never get the ""everything is top priority"" answer that is so common.3. Feature Flags. This is one of the absolute keys from a best practices perspective and it also critical for a continuous delivery environment. It allows dev to deploy to production behind a flag rather than hold stale branches while waiting for marketing, product, etc to give feedback, documentation etc. Product gets the benefit of being able to show features to specific clients, gather feedback, etc in a production environment while everyone else can prepare to release when they are ready...without having to bog down development with that entire process. The idea of separating Deployment from Release is hard for a lot of people to wrap their heads around.The biggest complaints that I see around SAFe are that it's too rigid and/or that it's waterfall.It's neither of these things. It's made to be adapted to your company and all it involves is a collection of best practices that work really effectively together. They adopted a lot of current practices, like Scrum, into Reinertsen's work because it's easier for an organization to adopt it if they think they're already doing a lot of it. Each team within a SAFe environment can use Lean, Scrum, Kanban, etc. It's up to the TEAM entirely. Scrum structures are just there because a lot of people are already using them.As for the waterfall bit, I reject this entirely. There's a large group of people out there that seem to think even acknowledging a dependency means you have a waterfall process and I bristle every time I hear it. The PI Planning structure allows you to coordinate team planning over 8-12 weeks.Have you ever been in a scrum environment where the teams didn't have a clear path to coordinating? It's awful.Moreover, the structure allows (and insists) that your developers actually provide the plan. This means nobody else has handed you a deadline and your entire team gets to have a dialog about what can be done in what amount of time. You discuss tradeoffs with management if they ask for the world and they only really need a piece and then discuss how to get that piece.How many environments leave developers out of this process entirely? Just handing you tasks?I'm a huge fan of SAFe because it's goal is to provide an environment where developers can thrive. Every time I see comments about SAFe and ask questions about it, I get responses like ""they didn't do that in our SAFe implementation.""That's because your upper management nixed it. It's not because it wasn't supposed to be there.Personally, I'm a huge SAFe with Kanban advocate.If you have questions about SAFe at your company or you simply want a second opinion on what you're being told, feel free to hit me up. I'll be happy to answer any questions that I can."
skeeter2020,"on Oct 29, 2022","This post is classic SAFe and SAFe-certified trainer talk:* It starts by stating ""I'm a SAFe consultant now, but at heart I'm a developer just like you!"",* It conflates what SAFE says it does (continuous deployment; empower developers; responsive teams) with what it PRESCRIBES (coordinated release trains; process over people; commitment to long term deliverables up front),* It speaks to the executives and management that will decide to adopt SAFe, not the developers who will need to somehow work within it,* It somehow promises to combine bottom-up agile with top-down date-based delivery commitments then hand-waves away the collision of these intractable approaches,* It pleads that SAFe is not heavy weight even though all SAFe offers is hundreds of pages of process and rituals,* It attacks anyone who is concerned or unwilling to do SAFe, as obviously they'r the ones with a vested interest in not adopting SAFe,* It presents the straw-man argument that the alternative to SAFe is teams that can't coordinate,* It concludes that if you didn't see all the supposed benefits from SAFe, ""you did it wrong"",* Like SAFe itself,it's long, full of platitudes, self-promotional and in the end leaves you ready to surrender just to make it stop.Question for the group: Do you know anyone who's livelihood doesn't directly depend on adopting or enforcing SAFe who is a big booster?My favorite SAFe quote:""SAFe uses agile like a drunk uses a lamp-post: for support, not illumination""."
delusional,"on Oct 29, 2022","> * It conflates what SAFE says it does (continuous deployment; empower developers; responsive teams) with what it PRESCRIBES (coordinated release trains; process over people; commitment to long term deliverables up front),As is common with political initiatives. First the values are listed, then the motivation for those values are presented in a way that nobody can disagree with. Then the slight of hand: the proposed solution is assumed to be the only possible fulfillment of the values. All discussion about the mechanisms by which the solution fulfills the promises of the values is cast as disagreement about the values. ""How could you disagree with coordinating your work"" instead of ""how do you think our activities don't lead to coordination between teams"".It's unfortunately a very effective strategy."
brightball,"on Oct 29, 2022","I’m not a SAFe consultant. I’m certified but I consult on a lot of things: Postgres and application performance tuning, DMARC deployment, pipeline automation and organizational process.I’ve also never certified anyone in SAFe professionally. The principles work but I’m not a believer in adopting it strictly in organizations. Instead I observe and recommend improvements in existing companies once I understand their dynamics.In many cases, aspects of SAFe are effective recommendations.Whether you formally follow the PI Planning approach to get everybody together or you find a better fit for remote staff, letting your devs plan 10 weeks at a time instead of 2 is beneficial for everybody. And cuts down on a lot of every 2 week meetings to support it.And all I’ve shared is my own experience. I constantly see straw men arguments against it posted.When you scrap the SAFe with Scrum approach and replace it with SAFe with Kanban 90% of the ceremonial meetings go away.Most devs I talk to don’t even realize there’s supposed to be a backlog that they prioritize without having to consult the business side of the house.There’s no question that the anti-SAFe crowd has legitimate gripes with bad environments. Their concerns aren’t any more
valid than the concerns of anti-Scrum proponents who have been in bad environments.It’s trying to solve a hard problem but under the hood it’s just best practice after best practice smooshed together.Get the scrum ceremony out and SAFe gets a lot cleaner for everyone involved. You’re basically just adding more ceremony if you use scrum within SAFe. If you use Kanban, you trade for much less frequent ceremony so you can focus.SAFe instructors are taught WITH the scrum ceremony and IMO that is the root of all of the blowback."
drran,"on Oct 29, 2022",N/A
29athrowaway,"on Oct 30, 2022","If you haven't met the customer, it's not agile.Product owners are not the customer. Scrum is watered down agile.SAFe is simply not agile."
namdnay,"on Oct 29, 2022","Ahhh feature flags, the sick organization’s last crutch.Three years down the line, every customer is using a slightly different combination within the hundred flags that have appeared, you’ve just fallen back the latest release for the fifth time because of an unforeseen interaction between three unrelated flag states, and then you go through the test suites and you realize that it is mathematically impossible for you to cover every combination :)"
brightball,"on Oct 31, 2022",That's not feature flags. You're referring to user options that individuals or companies can enable or disable.Feature flags are controlled entirely by the product team and designed to be removed after the product team has formally released the feature everywhere. Good feature flag systems like Unleash even track stale flags so you don't forget to remove them.
asplake,"on Oct 29, 2022","I know Don Reinertsen and I did his training workshop a years ago.The thing is, you can’t take a set of principles (which his stuff is) and then claim that rolling out your design (a different beast entirely) means that the poor customer is following them too. Ok you can try, but it wouldn’t be true.FWIW I’m the author of one of the better-known Kanban books. Plenty of Don’s influence in that world too (a good thing), not that I’m active there now"
brightball,"on Oct 30, 2022",Just ordered a copy. Looks like a great read.
flerchin,"on Oct 29, 2022","In practice, all the ills that you decry as NOT SAFe, are what happen at every organization that I have been a part of that tried SAFe. The prescriptive framework and focus on process over people are the easy part, and an easy trap to fall into."
CipherThrowaway,"on Oct 30, 2022",Have you worked in many environments that have implemented SAFe well? These theoretical benefits seem to be hard to translate into practice.
