Author,Publication Date,Review
commandlinefan,"on July 1, 2019","> If we need X then let me work on itIf you look through the managers who are weighing in on this thread, you’ll notice a common perspective: they don’t trust you to actually work on something.  That’s why I have so little hope for any software methodology - even if it starts from something positive (like XP, which was the precursor to “agile”, did), it will be turned into “I know all of my programmers are stealing from me, how can I stop them?”"
hinkley,"on July 1, 2019","In part because we still measure effort in hours instead of in wear and tear.  That guy answering comments on Hacker News is probably trying to recharge, not steal from you.I learned recently that the crane operators that unload cargo ships at some major ports can’t work more than four hours at a time. The movements are too precise and take a great deal of attention. I think you can work two shifts per day but there’s a mandated gap of some number of hours between them."
outworlder,"on July 1, 2019","> At most your example argues that asking inexperienced and clueless devs to estimate stuff they know nothing about produces highly unreliable information.Wow, so much hubris in such as small post.Unless you have been doing the exact same thing forever(in which case you are at a risk of being replaced), new work _always_ comes with a degree of uncertainty. Be it new technologies, new business requirements or what have you. I have never worked in two identical projects in my life.The correct answer would be a 'spike' or proof of concept. Either that, or hire those magical developers you seem to have who know everything there is to know."
twic,"on July 1, 2019","Writing software is design, not manufacturing [1]. Do companies know accurately in advance how much it will cost to design a new nuclear power plant, aircraft carrier, or jet engine?[1] http://www.bleading-edge.com/Publications/C++Journal/Cpjour2..."
apatters,"on July 1, 2019","There are times when something truly original is being built and it's a valid argument for estimate uncertainty. But a significant portion of the industry is engaged in building CRUD app #237 or Ho-Hum SaaS #17, and a significant percentage of estimates end up wrong because some developer who was bored with his job decided to use a blingy new Javascript framework he had no experience with because he wanted a challenge. Money gets lit on fire again and again this way and it's frankly selfish and irresponsible."
sarchertech,"on July 1, 2019","If the software is truly that unoriginal, use something off the shelf. The issue is that in literally every non-toy product I've every been involved in the product owners will always turn CRUD app #237 or Ho-Hum SaaS #17 into something significantly more custom and much more complex.>because some developer who was bored with his job decided to use a blingy new Javascript framework he had no experience with because he wanted a challenge.That definitely happens, but I think it's a different problem."
asark,"on July 1, 2019","> The issue is that in literally every non-toy product I've every been involved in the product owners will always turn CRUD app #237 or Ho-Hum SaaS #17 into something significantly more custom and much more complex.YES! The cost of custom-everything design and bespoke gee-whiz is vastly under-appreciated, IMO. CRUDy Android and iOS apps using built-in widgets and simple color theming? Relatively easy to estimate, and pretty damn fast. Custom-everything, we want both to look pretty similar (so, probably Material-ish given current trends, which you'd think would come for free at least on Android but... doesn't), custom animations everywhere, oh I hate that default date picker on this particular Samsung phone (and sure, it's god-awful) can we customize it, and the designer came up with this layout for this form that requires all kinds of twisty-bendy manipulation to reproduce versus something more straightforward but that's what the ""stakeholders"" approved so let's do that.Et c. et c. and pretty soon the app's 10x as expensive (no exaggeration!) because you couldn't live with the easiest-for-the-user-anyway default styles with some custom coloring.And the Web's at least as bad. Often you're also making your page way less usable and breaking it on certain browser/device combos due to the extra effort you put in to make it ""pretty"", at great cost.[EDIT] in fact I've in the past suggested providing design points for ""pretty gee-whiz versus not-actually-bad straightforward implementation"" to make product owners choose between getting e.g. three normal (and OK-looking but not ""pretty"") features or one pretty feature in a sprint, to make this cost more visible and give owners on a budget more flexibility in shipping features, but it never caught on—in particular designers hate, hate, hate the idea, I think because it might expose that their work is sometimes (often...) more expensive than it's worth (and vastly more expensive than they're being paid, since it also eats huge amounts of developer time) given you've got some developers with even a hint of aesthetic and UX sense on a project."
cr0sh,"on July 1, 2019","I wonder if you looked at time estimates from developers of common process applications (like CRUD) in say, the 1980s, who used COBOL or FORTRAN, vs say those using Pascal or C - if those developers of code using extremely well known processes and libraries had better estimates than those using the ""newer bling""?"
hinkley,"on July 1, 2019",Design or repair.These are the same people who get furious at their mechanic or plumber when they double the time estimate.
danielbarla,"on July 1, 2019","Nothing, inherently, except perhaps the fallacy of comparing a pair of jeans to the rather chaotic and unpredictable world of bespoke systems development.  One is inherently known (a pair of jeans you've presumably already manufactured), the other is one big unknown, basically."
commandlinefan,"on July 1, 2019","Right.  You can imagine a conversation something like:""Ok, how long is this project going to take?""""Well, it's still being defined...""""What do you mean you refuse to tell me how long this project is going to take?""The analogy is so ridiculous that the person making it clearly doesn't even comprehend the domain he's discussing."
ellius,"on July 1, 2019","Aircraft, hospitals, hotels — a million complex bespoke things are built every day. Cost and time projections are inevitable."
marcosdumay,"on July 1, 2019",> Cost and time projections are inevitable.As inevitable as blowing through the projections.
ben509,"on July 1, 2019","He compared to jeans because they're an extremely trivial purchase that someone would give little thought to, but still demand to know what they cost. The point is that in all cases you need that information, with a major software project you simply need it far more."
commandlinefan,"on July 1, 2019","> you needAnd that's the core of the problem (which, ironically in the context of the article, agile methodologies were supposed to address): wanting or needing something to be true/exist doesn't make it so."
mstade,"on July 1, 2019","I think maybe the point they're trying to make is that comparing a software development project that may include a number of unknowns to buying a pair of jeans where there are probably very few if any unknowns is fallacious and a waste of time.That said, I don't think it's black and white. Some projects, making a simple web site that follows whatever Squarespace template is popular and filling it with some relevant content can be a pretty simple project, even to the point where the buying a pair of jeans comparison makes more sense.The problem, I suppose, is when you believe strongly that every project can be accurately priced up front. Not every project is a moonshot, but some truly are and it's not always obvious up front which ones are."
lonelappde,"on July 1, 2019",N/A
asark,"on July 1, 2019","It is when stakeholders throw curveballs.""We want you to do this.""""Sweet, easy enough, I'll just use X, Y and Z, no problem.""""Oh but sorry you have to use A, B, and C instead. Oh and it'll need to connect to D for reporting, and we'd like it to sync with E which we've never done but they have an API so it can't be too hard, right? Oh and it needs to fit this design we've already approved that's about as far from native to the platform you're developing for as it could be and has a ton of UX issues that require fundamental changes to fix, which you'll uncover as you work. That's about as easy, right?""""....""[EDIT] oh and also one ""minor"" feature we're going to toss in later is actually big enough to build an entire company around so you'll have to waste a bunch of time talking us down from that while we quietly lower our opinion of you, and we've accidentally described a few things which are basically impossible by egregiously violating e.g. CAP theorem or being what's effectively a highly-available distributed filesystem that needs to fit without our timeframe and budget, which is 1/20 what it would take to maybe build that and that alone."
duchenne,"on July 1, 2019","As a consumer, I can buy an already manufactured pair of jeans or an already programmed Adobe Photoshop for a fixed price.As a producter, the cost of building a jeans factory does not seem to be inherently more predictable than the budget of a software development project."
ghostpepper,"on July 1, 2019","I think, to take this analogy a step further, you need to make sure your manager realizes the factory is not built yet."
lonelappde,"on July 1, 2019",N/A
threwawasy1228,"on July 1, 2019","The recent Foxconn plant in Wisconsin that may or may not be happening is a great example. They committed earlier, and claim now that their initial estimates were incorrect and that a plant in that area will not be profitable for them. They have now stopped the plan entirely and reworked what it is they are going to build completely from scratch. This despite having already committed to building the factory.Even at scale people can pull out of complex agreements if their estimates turn out to be faulty."
cc81,"on July 1, 2019",You should be able to put it in a range otherwise you probably don't know enough to build it. You don't want to spend 100 millions on something that will save 1 million a year.
celticmusic,"on July 2, 2019",managers and business leaders make decisions based upon those estimates.Imagine if that cable guy coming your house said between 1 hour and 2 weeks.  Good luck making anything approaching a good decision surrounding the cable guy's visit.
draw_down,"on July 1, 2019",N/A
lordleft,"on July 1, 2019","The best way I've seen agile described is ""designing code in a way that acknowledges change.' I think there's a lot of value in understanding that you may have to go back to the drawing board when designing parts of your program. I have little regard for the entire industry that has risen up around agile, however."
collyw,"on July 3, 2019","That makes complete sense as a good way to go about designing software, but I don't think I have seen anywhere else describe agile in that way."
marapuru,"on July 1, 2019","Yeah, coming to the point where it's never completely finished. You just always anticipate on going back."
FpUser,"on July 1, 2019",Exactly my thoughts.
musicale,"on July 1, 2019","There is a similar problem in the research world; the work must be genuinely novel (and fundamentally unpredictable), but funding organizations such as NSF/NIH/etc. demand a timetable and specific deliverables.The problem is usually solved in three important ways:1) making the deliverables as vague as humanly possible2) promising experiments and not results3) applying for grants for work that you have already completed, and using the money to work on the next grant's projectThe problem of having deadlines that are too far out is mitigated somewhat by the pressure to publish. Publishing has fixed deadlines but somewhat flexible deliverables."
Isamu,"on July 1, 2019","Agile is not science-based, it is an ad hoc bag of techniques that seem to have merit. As such you have to be able to reason about what your practices are and you have to relate everything to concrete business goals.Your goal should never be to become ""more agile"". You should be looking to improve efficiency, to make sure you are building the right thing, to improve communication so that everyone is on the same page, etc. ""Agile"" is never going to magically improve anything."
FpUser,"on July 1, 2019","""Agile is not science-based, it is an ad hoc bag of techniques that seem to have merit""Each participant of ""Agile"" development should have this hung on their work place."
taylodl,"on July 1, 2019","Uncle Bob wrote about this in The Tragedy of Craftsmanship (https://blog.cleancoder.com/uncle-bob/2018/08/28/Craftsmansh...). His perspective is Agile lost its way once the Project Managers stepped in. It seems to me the problem with Agile in practice today is there's too much focus on process and not enough focus on, you know, the actual software being delivered. Add to that a host of less-than-desirable ideas that have taken hold (don't even get me started on emergent architecture) and you realize modern Agile has become a cesspool.What to do if you're on an Agile team? There's value in the Lean Methodology. Remember, the whole point was to deliver software your customer needs to fulfill their business objectives. Continually assess your Agile practice and see if what you're doing still makes sense for the project you're working on right now and for the current stage that project is in. This continual assessment with a focus on the end goal of delivering software can go a long way to addressing Agile's modern ills."
F_J_H,"on July 1, 2019","I had not heard of ""emergent architecture"" until you implied you hated it, and so I thought I would Google it.I have no idea what emergent architecture is in the agile context, but the idea of emergence is fascinating to me, and has been ever since I read ""Emergence: The Connected Lives of Ants, Brains, Cities, and Software"" by Steven Johnson.We see the idea of emergent design everywhere in nature and society.  I'm not suggesting everything can be built and designed ""emergently"", but certainly some things can be.  See the book (and concept of) ""the cathedral and the bazaar"". The idea of something useful coming into existence without central planning is an enticing one, and so I can see the draw."
LyndsySimon,"on July 1, 2019","Thank you for that book recommendation - I just bought it and am looking forward to reading it :)I also had not heard the term ""emergent architecture"" in relation to software development. I'm intimately familiar with the concept of emergent order, though, and my grokking it was part of my ""political awakening"" in my 20s. It led me from being a libertarian-leaning conservative to an anarcho-capitalist. To put it another way, I believe that the system create by independent actors acting in their own self-interest naturally create the most efficient system possible within the constraints of the environment within which they operate.There's a name for this concept when applied to company management, but I can't recall it at the moment :(. I want to say the word has a Greek root, and it reminded me of ""autarchy"" (""self organized"") but that wasn't what it was called."
F_J_H,"on July 1, 2019","You'd probably like Milton Friedman's ideas, and I'd be surprised if you've not already come across his work and YouTube lectures.There is something to be said for small government, but also can go too far: actors acting in their own best interest can obviously cause harm to society or to the larger group as a whole (See ""tragedy of the commons"").Related to emergence is rapid iteration, and it's importance to analysing complexity, which is caputured nicely in ""Boyd's law"". See https://blog.codinghorror.com/boyds-law-of-iteration/, and then see if you can find the referenced paper by Roger Sessions. (Sessions seemed to caputure the essence of ""Lean Startup"" before it was cool...)"
mcv,"on July 1, 2019","""It’s just that everyone does Agile wrong.""Not everyone. Some are very successful with it. The problem is that everybody wants to copy that success and tries to cargo cult themselves through it without understanding it.""let’s stop pretending Agile was some sort of cure all.""That's certainly good advice. Agile is more of an attitude than a solution, and attitude is not going to solve all your problems. Even if you are as Agile as you can be, you still need to solve your problems. It's just that being Agile might make you more flexible and effective at solving those problems.And Lean is certainly more comprehensive than Agile. And I don't think they contradict each other. In fact, they're very similar; they're both about empowering the people who are doing the actual work.""management thinks the focus should still be scope and deadlines and efficiency, ignoring that the deadlines are arbitrary and the requested time estimates are a form of waste.""Then management is not Agile and hasn't properly learned what it is. That is sadly common. Agile is not magically going to solve bad management, but Agile does emphasize keeping management at a distance and empowering developers.""Agile actually tends to mask the core problem, which is a systemic, bidirectional lack of vertical trust.""Does it mask that? I think it exposes it. Without that trust, Agile cannot work. Agile insists on that trust. I suspect that every case of broken Agile is caused by a lack of trust. Fix the lack of trust (or use a system that works without trust if you absolutely must).""Did you know story points were actually invented to obscure time and help alleviate this problem? That backfired too, didn’t it?""Yes I did and no it didn't. Every single team I've worked in over the past 6 years knew this and kept repeating it every time someone comes along and tries to match story points to actual hours.This first half of the article suggests the author has mostly worked in very toxic management cultures."
unreal37,"on July 1, 2019","I agree with a lot of what you said.My last company (before going self-employed) had an agile environment and it was mostly a good system to work in.I don't recognize the fairly strictly Agile (not AINO) environment I worked in in that article. Not perfect, but it worked and better than a lot of places that had no good methodology."
mpweiher,"on July 1, 2019","I agree that almost all of the orgs I encountered that were Doing Agile were pretty horrible.On the other hand, I've also been in orgs that were very successful in developing software in a way that we would recognise as being agile.  We just didn't make a big deal out of it.  And we didn't do standups (most of the time), or 2 week sprints, or retrospectives.  We didn't even pair consistently:  we split up on trivial stuff, paired on hard stuff, as needed and available.In one org we started without TDD, and even without having much in the way of automated tests at all.  But when we discovered testing and TDD, boy did we ever embrace it.  Not because anyone told us to (mid-to-late 90s, so no Agile Manifesto), but because the difference for us developers was night and day.So develop software.  Concentrate on what helps you develop software.  In my experience, you will probably discover something recognisably agile all by yourself.  So when you discover that, help yourself to what helps you.  Don't make a big deal out of it."
maxxxxx,"on July 1, 2019",What you are describing is exactly what Agile should be. You have a team of people who care about the craft and they slowly improve processes based on real world feedback and experience. If something doesn't work you drop it and try something else. This happens in environments where people respect each other.
rtikulit,"on July 1, 2019","Management does not want to hear that software development is a craft. They want it to be a trade, with fungible workers operating in a predictable process with fungible components. The great tragedy of Agile is that it was co-opted as the vehicle of this transformation. It was seized by management, weaponized to other purposes, and then aimed right back at us."
bloorp,"on July 1, 2019","Yeah, I've come to similar conclusions about Agile. It can be a great way for an already well-disciplined organization to think about the work they're doing. But many, many undisciplined organizations thought that Agile would be a catalyst for them to become disciplined. But the nitty gritty of ""doing Agile"" required EVEN MORE discipline than what all these organizations were already capable of exercising, so it just highlights all the frustrations everyone already has.That does seem to be the downside of Agile. It's a collection of maybe a dozen different techniques and practices. But if one of those practices falters, whether it's the TDD, or the business side still wants a certain deadline, or you don't bother to demo at the end of a sprint, then the whole house of cards falls like dominoes..... checkmate!"
hef19898,"on July 1, 2019","Sounds a lot like TPS, I assume Toyota did a lot of the stuff before any books were written. Also, my personal experience, the more companies talk about Lean and Six Sigma the less they do it."
mpweiher,"on July 1, 2019","Similar with ""culture"".  Companies with a great culture don't talk much about it, they just get shit done without much fuss and typically have some fun doing it.  Because getting shit done is fun.On the other hand, if the company all about how fantastic the culture is...run!  Or at least tread very, very carefully."
maxxxxx,"on July 1, 2019","Totally agree. Talking about culture or hanging up ""inspirational"" posters is usually a warning sign. Good organizations live their values and don't feel a need to constantly talk about them."
HeWhoLurksLate,"on July 1, 2019","That reminds me of my two favorite interviewee questions:""What's your company culture like?""  - the way that the interviewer responds is a pretty good indicator of what their culture is like.""If someone does something exceptional, how do you reward them?""  works in a very similar way."
rtikulit,"on July 1, 2019",Maybe even step back to first principles... “Can your company even recognize when someone does something exceptional?”
asdfman123,"on July 1, 2019",Build trust and respect instead of elaborate processes to compensate for the lack of them.
marcosdumay,"on July 1, 2019","> Doing AgileYou mean the ones following one of those canned ""agile processes""?It always amused me how people could read the Agile Manifesto and then conclude that it's best satisfied by following a canned process."
Zenbit_UX,"on July 1, 2019","Got any insight as to why TDD is such a great thing?From how Ive heard it described it seems to be a way for management to impose rules on how developers can approach writing a feature and not necessarily a benefit to the devs.If I understand it properly, it's essentially write a test so it fails then fill in the feature gap. The whole write first bit is just so you don't have to retest later to verify that your test didn't hit a false positive, right? Something a careful person would check anyways..."
