Author,Publication Date,Review
TeMPOraL,"on July 1, 2019","Heh. I have a reverse sentiment. As a programmer, I want to communicate with the actual users who'll be using my product. But without two layers of intermediaries on both our and customer side, who end up turning this whole thing into a game of telephone, ostensibly in the name of all the other important stakeholders."
giobox,"on July 1, 2019","The programmer users are arguably ""clients"" in this context too. Much the same sorts of issues, different labels.One need only look at the bug tracker on the average ""massively used library"" to see that you will be communicating with clients a great deal. Your dream of a small group of perfect programmers filing neat and accurate feature requests or bug reports doesn't match any reality I've ever seen. To expect them all to ""understand how coding works"" is also likely a pipe-dream - users of all ability levels are out there writing code, filing bug reports for things that aren't bugs, asking questions in forums that aren't meant for those questions, mad at you because the direction the project has taken isn't the one they or the company they work for want/need, etc etc..."
Sharlin,"on July 1, 2019","Users of a library are still users. You can write a library in an ivory tower, just like you can write applications in an ivory tower, but that kind of software is written for yourself and only incidentally for anyone else. People might still use it if there are no viable alternatives, but don’t expect them to be very happy about it. Especially because scarcity of communication also implies scarcity of documentation."
ebiester,"on July 1, 2019","You're abdicating your responsibility of developing working software. Your job is to solve problems, using code where appropriate. Your job is to understand the entire system and explain how the corporate system above interacts with the technology you are tasked to develop.If you can't do that, what is the difference between you and a group of outsourced employees making pennies on the dollar?"
techslave,"on July 1, 2019","you’re presupposing he wants to fit into that holistic model, as a senior person. maybe he is fine plugging away at code, the task defined, like a monk transcribing texts.the world needs both kinds, and a range in between."
collyw,"on July 3, 2019",">the world needs both kinds,But if one kind can do both types of tasks then you only need that kind."
madeofpalk,"on July 1, 2019","Ultimately, these days programming is table stakes - IMHO you get zero credit for knowing how to code. The best developers are those who are able to step up and actually interact with people to articulate and understand problems. Whether that's with fellow developers about code, with managers/stakeholders about technical things, or with end-users/clients about users needs.You're more than welcome to want to sit in isolation and code away, but I would suspect you would find it difficult to do this and be happy. I've never worked in a team that would work with someone like that."
opportune,"on July 1, 2019","Nothing is wrong with that, but if you want to work like that, don't be a software engineer"
kjsbfkjbf,"on July 1, 2019","There is nothing wrong with that, but careers under capitalism are about _signaling value_. I hope you find a place (or have found a place) where you're appreciated. :)"
unreal37,"on July 1, 2019","Upvote to this.As far as your career - salary and promotions and recognition - you can't just sit in a corner and be quiet. People have to recognize that you're good at what you do and it's hard for others to see when you only communicate in code check-ins.You have to start attending meetings, speaking at meetings, and being useful beyond the code."
ok_coo,"on July 1, 2019","I'm not sure why you're being downvoted but some of the best career advice I've heard is someone saying you should assume when you go to work that you're working under a communist dictatorship. I.E. Toe the party line, make your boss look good, (pretend to) eat up the company propaganda, assume the leader(s) (C-suite) will do whatever they want, when they want, especially giving themselves bonuses regardless of company performance.It's a weird contrast to normal life, considering a lot of us live in democracies, but once I understood this and started acting accordingly, it helped me handle my work life."
TheGRS,"on July 1, 2019","I don't know if that's great advice, but its certainly advice that will help get you promotions and salary bumps.Like anything there's a grey zone here. Understanding the political realities of a business is highly beneficial and will help you move forward with the company and let you know when to pick your battles. But I've watched people who do nothing but this lose the trust of those at their level. And that trust is crucial for agile development. I also personally feel like pushing back on the company when appropriate can indeed provide a lot of value to the organization. ""Why are we doing this meeting?"" ""We need another week for testing"" ""I'd like to see the roadmap you are planning"". Just don't push back all the time."
Nasrudith,"on July 1, 2019","It is probably good advise for most cases but individually depends on the shop and culture. Like if you really should always wear a three piece suit to interviews regardless of what they request. Some are flatter, others are more hierarchical (ironically practice can fail to line up with org chart structures).Some are all about the politics, others don't have the luxury of self delusion or actually value the sort of brutal honesty to say ""I have looked at the new framework - while trendy it is buggy inefficient crap."" The ones who lack the luxury tend to be smaller but small size is no guarantee that they'll just say no to the flavor aid."
eeZah7Ux,"on July 1, 2019",N/A
SkyBelow,"on July 1, 2019","Why?In all areas of life we judge those around us not by the true facts, but on our limited knowledge.  Working to improve that knowledge can result in a change in judgment.  It seems completely reasonable for there to be a person who does good work but who isn't know for doing such, and as such is viewed worse than they should be.  By working to increase the knowledge of the work they do, their evaluation in the eyes of others will improve.Of course, it isn't a straight forward or simple in practice.  There are those who lie and misrepresent, and if you are to obvious about your intent you will be viewed as manipulative.I don't see why this deserves either the label of BS or a ban from HN?"
madeofpalk,"on July 1, 2019","Perhaps some thing think it's uncomfortably close to the 'slur' of 'virtue signalling' that people throw around. While I'm sure the intention was nothing but pure in how it was used here, it did make bit second-read the comment to assess whether it was being used in a negative way, and to really understand the point being put across."
0815test,"on July 1, 2019","> > All Agile did was put software development teams unfairly under a microscope.Most managers crave control over their teams; this is not something that Agile introduced. If anything, Agile let them use the sort of control they were already demanding towards more useful and productive goals, by introducing bazaar-like practices to centralized software development (release early, release often; shorten feedback loops as much as possible; make extensive use of refactoring, software testing and XP principles); while at the same time not being altogether incompatible with self-organizing development teams (these were mentioned in the original Agile manifesto, after all)."
lonelappde,"on July 1, 2019",N/A
Bartweiss,"on July 1, 2019","Eh? I'd compare it to No True Scotsman, not AI: I mostly hear people insist that anything which doesn't work isn't Agile.I'm extremely grateful for the changes agile wrought on the software industry, and while I think many of the best insights have become commonplace, I don't think formal Agile methods are outdated or exhausted yet. But I do think formal Agile is extremely hard to do right, and has very common failure modes of knowingly-unrealistic planning, unproductive meetings, excess design changes, and tech debt neglected to ship MVPs.One measure of a methodology is how much value it provides when it's used right, and I agree that Agile shines here. But it's also worth asking how easy a method is to get right, and how gracefully it devolves when things aren't perfect. My experience is that agile advocates commonly neglect those parts, dismissing widespread frustration with 'bad agile' on the basis that if it had been implemented perfectly, those issues wouldn't have come up."
me_again,"on July 1, 2019","I have a theory that commercially successful software development methodologies are like diets: they have to be almost impossible to follow. This ensures that when you fail to lose weight/achieve bug free software, you blame yourself for not following the rules exactly, rather than the rules for not working."
Bartweiss,"on July 1, 2019","At the very least, I think it's common to judge methodologies by ""how well does it work when it's done right?"", when we should be using a three-part test.1. How much value is there if it goes right?2. How easy it is to get right?3. How gracefully will it break down if it's not done perfectly?Methodologies don't have to shine on 2 or 3. NASA-style clean-room coding is the gold standard of hard-but-effective; you have to suck it up and commit entirely with a great team, but the results are unbeatable. Waterfall was ""good, bad, bad"", but used by lots of less-exceptional teams with hideous results.Agile, I think, improved #3, but not #2 so much. It's commonly sold by appealing to how much it can potentially help, but I think the more honest pitch is ""it's tough to do right and it'll sting if we get it wrong, but it hurts a lot less than getting waterfall wrong."""
dclowd9901,"on July 1, 2019","Then maybe there should be one rule (as was my most successful dieting effort): Is what you're doing helping make or save money?I know such a simple rule is probably causing a lot of you to cringe, but I can very easily fit just about any activity of value you or your team embarks on into that question, and it's a rule the entire company can get behind."
ff317,"on July 1, 2019",N/A
sombremesa,"on July 1, 2019","I think with this analogy you're presuming that people are exposed to a variety of foods and there is some positive correlation between action and awareness. However, for someone who only ever goes to McDonald's to eat, they'll just switch to french fries and ketchup for your nonsense diet."
orblivion,"on July 1, 2019","I've definitely seen a ""your cholesterol going up only means you need to Paleo harder"" post on a forum."
nosianu,"on July 1, 2019","""Thou shalt not be negative"" (HN) - well I'm sorry. Just some example text:> both Agile and Waterfall are focused on building. Design is about validating.or> So…what’s the way out? It’s a smart focus on clear outcomes, not output, with roadmapped outcomes replacing planned milestones, with trusted product teams, not project teams, empowered to vet assumptions and discover the minimal path to value.Satire? Enough words to fill a hot air balloon or two. ""Smart"" focus, ""clear"" outcomes,  ""outcomes"" vs. ""milestones""(?), ""trusted"" product teams (as opposed to... what?), ""empowered"" etc.?Far more interesting than the contents of many links that make it to the HN homepage is discovering the fact that they do so."
tootie,"on July 1, 2019",Honestly that statement is the nail on the head for me. There's a huge distinction between an output and an outcome and a huge distinction between a project plan and a road map.
nosianu,"on July 1, 2019","> between an output and an outcome and a huge distinction between a project plan and a road map.I mention neither of those.I'm not complaining about your reply, I think it shows how those texts are (to be?) used: Just like art. You project your own experiences into it, it's more about getting you to think. So naturally different people are going to react differently and read different things into the same text. That's perfectly alright - you get something out of it (only) if you put something in. If there is nothing to begin with, which may just be lack of experience (new programmer), you'll get less out of it. If you have two decades large project experience in various companies and teams you'll get a lot out of it. Let's attempt to make the best out of it then, out of any text, if we are presented with that opportunity and the headline got us to click on it :-)"
itsdrewmiller,"on July 1, 2019","I think you misread the part you quoted, while GP read it correctly - it's comparing outputs and outcomes, not outcomes and milestones."
nosianu,"on July 1, 2019",N/A
jeremyjh,"on July 1, 2019","> It’s a smart focus on clear outcomes, not output"
cljs-js-eval,"on July 1, 2019","In the spirit of that second paragraph - focusing on outcomes, not specific implementations - here's a rewrite:Original:> So…what’s the way out? It’s a smart focus on clear outcomes, not output, with roadmapped outcomes replacing planned milestones, with trusted product teams, not project teams, empowered to vet assumptions and discover the minimal path to value.Rewritten:> So… what’s the way out? It’s a focus on clear outcomes, not output.  There should be dates for when specific outcomes should happen.  Teams should be empowered to find the minimal amount of work needed to achieve the outcomes.It's a really wordy way to say what any good leadership class would tell you.  Focus on what you want more than how you get it, and let your subordinates decide how to get it.  Both good product teams and project teams are capable of working that way.This kinda sums up my problem with endless agile vs. waterfall vs. whatever discussions.  The interesting parts aren't really new ideas and the extra buzzwords add nothing."
Terretta,"on July 1, 2019","Interesting, I’d interpret “roadmapped outcomes replacing planned milestones” to mean there should not be predetermined dates and deliverables (planned milestones), but rather, a sequence of value-delivering outcomes (roadmapped outcomes)."
cljs-js-eval,"on July 2, 2019","A relative order of outcomes could also work, yeah.  You'll have a date in there somewhere, though, even if it's not driven off the amount of work.  Could be ""and if we can't achieve this outcome by X date we give up on this whole outcome""."
commandlinefan,"on July 1, 2019","You don’t hear the name Joel Spolsky much any more, but he was pretty influential in software process thinking in the 90’s - not really for being particularly insightful or original, but more because he was one of the first people who thought of writing a blog about software design.  One of his early “observations” about software project management was that “you wouldn’t buy a pair of jeans without knowing how much they were going to cost, why would you expect your manager to sign off on a software project without knowing how much it was going to cost?”  The utter blithering stupidity of this perspective highlights how managers look at software design: the purpose of software methodology is to put a fixed cost on every software project.  As long as that’s what they’re looking for, software methodology is going to continue to be a lost cause."
lbotos,"on July 1, 2019","Your argument here is against ""business"". In a dream world, where we could build for building's sake, and create ""more perfect"" things with no considerations for cost, I'd agree with you, but businesses (in the abstract) are a math function: Does it cost us less to make this than we charge for it? If so, we are a profitable business, if not, we are an unprofitable business.Managers are there to manage costs, to protect the ""business""."
icebraining,"on July 1, 2019",N/A
unreal37,"on July 1, 2019","I think every owner of a casino knows there is luck involved in their profits, and that the odds are stacked slightly in their favor.I don't think any owner of a business thinks that there is luck involved in creation of their software systems. They absolutely look at the $10 million per year they are spending on ""IT"" and look at the $26 million per year in value that spending is unlocking in absolute dollar terms."
commandlinefan,"on July 1, 2019","> thinks that there is luckYou mean ""realizes there is luck"".  And hence the problem."
andrey_utkin,"on July 1, 2019","I'm sure they have very good idea. Statistics, game processes design, everything is engineered towards stable and predictable profits."
pluto9,"on July 1, 2019","But they know that the sum of all cards drawn will be profitable, because their practices guarantee it. Normal businesses cannot guarantee that the sum of all their projects will be profitable."
brightball,"on July 1, 2019","That's one of the big reasons that I've become a proponent of Donald G. Reinertsen's approach to product development.He emphasizes a variation of the cost benefit formula + urgency, called Cost of Delay for prioritizing that basically boils down to ""Value / Time Remaining"" because your cost is the time remaining. It naturally prioritizes work based on shortest time to value because, unless the value proposition is enormous, dividing by estimated time is almost always going to favor the shorter tasks.This will of course vary by team, but in general it puts a focus on responsiveness and getting the little stuff out of the way first (including tech debt). When you have a formula that doesn't let the little stuff build up, it gets easier to focus on the big stuff too. It's also make it easy to pivot because it totally disregards prior time investments.It meshes better with what agile is supposed to be better than any other methodology that I've encountered to this point."
reallydude,"on July 1, 2019","> including tech debtTech Debt is not little, or we wouldn't carry it around, rather than devote time (and risk of revealing new unknowns) to fixing it. My agile experience has always favored conquering little stuff first, since ppl recognize stories more than points (which vary in value, over time). This, unfortunately, sometimes leads to the hilariously subversive act of splitting a story up into as many tiny pieces as possible so that some people may inflate that ""What have you done for me lately"" list while more tangible coding is done by others."
nitrogen,"on July 1, 2019","splitting a story up into as many tiny pieces as possibleHonestly I think that's the intended outcome from the business's perspective.  The smaller the piece of work, the easier it is to assign a cost and a benefit to it, and the easier it is to hand off to another developer."
Groxx,"on July 1, 2019",">... and the easier it is to hand off to another developer.I have never seen this work out in practice.  And it's like a 1%-of-the-time thing anyway.On the flipside, I've seen quite a few hours wasted adding fake subdivisions to tasks, probably close to 30% of the time.  Outside of small, known bug fixes or tech debt cleanup, it's rare for a thing to wholly fit within a sprint."
brightball,"on July 1, 2019","Cost of Delay metrics do a good job of explaining how the cost of that debt can grow over time the longer it goes unfixed. Some are smaller than others, but uniformly it tends to get harder to fix the longer you wait to fix it.He also doesn't place any type of value in points or other, bluntly, useless metrics for measurement. The entire focus is around delivered value. You can break it into however many stories you want, the value is the same. The measurement of how many things you delivered or how much time they took is not important to the company.What's important is how much value was been delivered to the company. It's the only metric that matters."
emiliobumachar,"on July 1, 2019","The subtler point is that if the developer won't make an estimate for how much time a feature will take, than the manager will. And the manager's estimate will tend to be even worse than the developer's, so we should all prefer that the developer makes the estimate even though it will be a bad estimate in an absolute scale.Note that the manager's estimate may be implicit or explicit, conscious or unconscious, but they will make one in the absence of the developer's. An implicit estimate would look like the manager doing a ""gut call"" when deciding whether or not to give the go-ahead to a feature, with no numbers attached to time and cost."
mcv,"on July 1, 2019","The problem is that if the developer gives an estimate, the manager might hold him accountable to it. If the developer can't even meet his own estimate, that proves to the manager that he's a bad developer. (He's not; he's just bad at estimating development time, as is everybody else.)And that's what Scrum and story points are for: to help you make long term estimates once part of the work has been done. You use the feedback on how abstract story points turn out in practice, to get a rough long term estimate of how long the work is actually going to take. Without being so explicit that anyone can be held accountable to them."
emiliobumachar,"on July 1, 2019","The real problem is treating the estimate as a commitment, but Spolsky does rail against that."
geezerjay,"on July 1, 2019","What's stupid in wanting to get an idea of how much a project costs in order to decide if it's a good idea to pursue, let alonr allocate resources?"
ALittleLight,"on July 1, 2019","""How long will X take?""""I don't know, I've never done X before.""""Yeah, yeah. It doesn't have to be perfect analysis, just a rough idea for scheduling. Not written in stone, ha ha.""""Uh, a week?""""Okay, great, so if I say 8 days you should have it done by then?""""Yeah, I hope so.""""Great, thanks.""Day 3: actually doing X requires unforeseen Y and Z which will each take a month.""We need to add Y and Z to the schedule, which will each take a month.""""There's no room for that in the schedule.""""Then I can't do X""""We've already costed X and committed to it. We've got to do X. We need to make X happen. When can you get back to me with a path to green for X?  And also, let's schedule a post-mortem to figure out why we missed on X.""At the post-mortem, PM doesn't show up: ""Uh, turns out we missed on X because I estimated it too quickly and the PM committed to those estimates. I didn't know about Y and Z when estimating, and these are things I could have done to detect them as requirements if I had known to do so.""Email from PM: ""Hey, could you give me an estimate for X'? Doesn't have to be perfect, ha ha."""
unreal37,"on July 1, 2019","""A week"" is a terrible estimate for complex things that have components that you can't foresee. If you lose ""a day"" on some problem outside of your control (compiling starts to fail and it turns out someone checked in some code into your branch by mistake), you've basically wasted 20% of your estimate.Never say a week when there's the chance something will require a month because you didn't understand it.You need to learn this lesson. A week is a blink of an eye in software, and only things you understand take a week."
ALittleLight,"on July 1, 2019","""Really?  X will take 'a month at least'? Why?""""I don't know why, but I don't feel comfortable guessing less because I don't fully understand X.""""Okay, that's not a good way to estimate. Why don't you spend some time to come up with a plan for X and we can estimate it after that. When can I have the plan?"""
aidenn0,"on July 1, 2019",You can have the plan in a week.
ant_li0n,"on July 1, 2019",Yes. This happens at my shop all the time and it's absolutely terrible.  Each sprint starts out positive and ends with panic attacks.
asark,"on July 1, 2019","I've solved this by not panicking about software someone else owns. Worked out OK so far. They can fix their processes and expectations (I'll help!) to get more value out of me, or choose not to. Not my problem. Environment gets too toxic, well, see ya, and good luck (you'll need it)."
cr0sh,"on July 1, 2019","This would've worked if you'd taken your initial estimate (1 week) - bumped it to the next unit (1 month) - then doubled it (2 months). Maybe you would've been given 9 or 10 weeks, so you'd have the week for X, and 1 month each for Y and Z.I understand this is a contrived example, but it's strange that, when you take a real project that ""overran"" based on the initial estimate(s), and you apply the formula - just how often the formula is actually really close to the actual amount of time.Not always - but more often than not."
geezerjay,"on July 1, 2019",N/A
ALittleLight,"on July 1, 2019","I've worked about 10 years at FAANG companies and I'm yet to meet the experienced and expert devs who are good at estimating things. I think your characterization of ""inexperienced and clueless"" devs is off.The reason I think my example illustrates a problem is it's moving away from agile. I shouldn't estimate X without understanding it?  Okay, I'll take the time to figure out, look around corners, etc. I realize I need Y and Z. I've got to estimate those, to estimate X, so I start working with other teams to figure these things out, and drawing up plans and schedules and who's doing what when to get all this stuff delivered. Now we're basically at the waterfall model where we're planning everything out before doing it.The other problem is that all the process is genuinely a waste. If we need X then let me work on it rather than do all the planning and scheduling nonsense. The schedule will be wrong anyway. If I have problems, need help, etc with X then I can raise those concerns and management can react in an agile way."
