Author,Publication Date,Review
tonyarkles,"on Oct 29, 2022","> After looking through the code to start implementing one feature (4 weeks into the 3 months) the team realizes there is need to change another team's API.On the estimation side of things, I've worked with teams that do estimates in concrete hours, days, weeks, etc, and teams that work in abstract feature points, bushels, etc. The number one factor for whether the estimates are successful is the time spent before providing the estimate to figure out what the actual scope of the task is. If you've planned and estimated a task and didn't discover the cross-team dependency during that planning, you've failed at planning. It happens. It sucks. It should be very rare.I've worked with teams where ""sprint planning"" every two weeks/whatever cadence is basically an entire engineering team getting pulled into a room for a morning, the manager/scrum-master/whatever pulls up their backlog and starts picking tasks off the top. The team is expected to provide estimate efforts on the fly in the meeting, and then expected to spend the next two weeks perfectly executing on the work they've committed to. How in the hell is a process like that going to allow people to really think through the issues that are going to arise (like needing an API change on another team, or even verifying that a 3rd-party API is compatible with what the task is trying to achieve)? These teams constantly run into the issue you've described and it absolutely sucks for everyone (the business, the managers, the developers), but the process just keeps being adhered to. Maybe in the post-mortem someone will say ""we need to do a bit more analysis before doing estimates"", and the outcome is that during the next sprint planning session the SM will say ""HAVE YOU REALLY REALLY REALLY THOUGHT THIS THROUGH?"" but... they're still doing analysis on 12 new tasks blind..."
theptip,"on Oct 29, 2022","Dream scenario - in the planning session note you depend on an external API. Prioritize an early spike/prototype of the feature to flush out dependency risks. Discuss relative priorities with the other team & schedule the work to modify their service.This requires teams to have slack/contingency time in their plans. That’s important.Of course, there will always be situations where you don’t spot a dependency until you start coding. But in the loosely-coupled mode, that is what happens every time you have a dependency on someone else, ie you have no opportunity to spot in advance. Worth some planning exercise you get an opportunity to spot the dependency and deal with it gracefully, even if you don’t catch 100%.But yeah, if there is no benefit to spotting early because the other team doesn’t have slack for the Q, then less point in planning in advance."
drran,"on Oct 30, 2022","It looks like risk planning was not done by your project manager. Risk planing includes risk prediction, calculation of possible time and/or monetary damage, risk reduction. For example, if we see that Foo can cause problem in near future with probability of 10% and can delay project with 5 members by 3-40 days, then average risk of lose is `0.1 * (40 - 3)/2 * 5 = 9.25` man-days. If we can reduce risk probability by factor of 10 by spending 2-man days of work early (1 man day of project manager + 1 man-day of a developer), then we will reduce cost to `0.01 * (40 - 3)/2 * 5 + 2 = 2.925` man-days, so 6.325 man-days are saved."
roguecoder,"on Oct 29, 2022",Collective code ownership is a prerequisite to most Agile processes for this very reason.
marcinzm,"on Oct 29, 2022",In my experience most companies specialize teams to various extents which makes true collective ownership difficult. An iOS team is likely going to have difficulty dealing with the ML code. This becomes even worse if the change is complex or touches the domain specific patterns.
drran,"on Oct 30, 2022","It's known as «the bus problem». Peer review is used to address this, to make someone else a bit more familiar with your code, so he will be able to help you when you are overwhelmed and need help (or when you hit by a bus). Also, built-in documentation, run books, guides, and automated test cases are very helpful for those, who are not familiar with your code base. It reduces job security tough. (I hit by that multiple times, because, for management, it feels like good developers and good administrators are doing nothing or constantly pick-up very easy tasks to do)."
manmal,"on Oct 30, 2022","But the iOS team can’t know everything about the server API, the ops team has no control over App Store release processes, iOS team usually has no push permissions for Android etcDifferent code bases in the org might even have different process certifications they have to follow, eg in medical software or some other industries. In those cases it’s downright impossible/illegal to give every team access to every repo.SAFe is supposed to solve this. I haven’t heard anything good come out of it though so far, so I find this thread very interesting."
kqr,"on Oct 29, 2022","Sure! I often start to make things which seem like a good idea at the time but after 1--8 weeks of A/B testing (or other verification methods) it turns out the market was not what I thought and it would be a waste of time to pour more work into it.At that point I can either ""stick to the 3 month plan"" and do something which I know has at best no value, or... try something else."
tonyarkles,"on Oct 29, 2022","> What sort of business are you in where you can actually meaningfully predict which will be the most valuable opportunities and ideas that will come your way in the next three months?I've got one foot in the pure software world and one foot in electronics hardware. I've worked with a number of startups, and some larger organizations and government.The SaaS startup world is the exception here, not the rule. Virtually any business that is not ""we're ready to pivot on a dime"" SaaS should be able to plan 3 months out. Generally speaking, any kind of strategic initiative is probably going to take longer than that to roll out. If there's any kind of manufacturing involved then design, V&V, manufacturing, and QA are likely going to be running on at least 3 month cycles.Sometimes things do pop up and it makes strategic sense to do a mid-quarter tactical shift to attack an extremely valuable lead, but that should be exceptional. Even in the SaaS world, people tend to jump on new ""valuable opportunities"" without really sitting back and assessing the cost of delaying everything else. This kind of organizational ADHD (one board member at a company called it ""chasing butterflies"") tends to result in a bunch of half-finished projects/products that all could have been valuable in their own right if they'd been run to completion instead of abandoned in favour of the next ""golden opportunity""."
ThalesX,"on Oct 29, 2022","Three months!? Is this the stability we expect from companies in our day and age? I would think it's a lost company, one that couldn't somewhat predict what the next three months are going to look like."
pflenker,"on Oct 29, 2022",Just look back 3 month and assess how many of the things that happened were predictable (keeping in mind the fact that hindsight is 20/20). I wager every company in the world was affected by the world wide  changes right now. Those who cling to plans are at disadvantage against those who have the ability to quickly adapt to the change.
hef19898,"on Oct 29, 2022","Just throwing things to the wall and see what sticks is not agility, nor is it just mindlessly running after any random car like a dog chasing the mail man."
tikhonj,"on Oct 29, 2022","Who said anything about ""mindless""? Just because work wasn't planned in detail in advance does not make it mindless—the people actually doing the work make creative, nuanced decisions as they're working. Not pushing a top-down, up-front plan gives people more room for careful nuanced thought.That isn't ""throwing things to the wall"" or ""mindlessly running around"", that's trusting a team of professionals to make effective creative decisions."
ThalesX,"on Oct 30, 2022",Who said anything about detailed planning? You’re throwing this in and then using it as a lever to push an engineering led approach. There is no such argument in this thread.There is however the argument of whether companies should look ahead for more than three months. And brilliant and trustable professionals don’t change my assessment that they should.
hef19898,"on Oct 29, 2022","I agree, if you have team of experienced professionals tgat is. If not, well, stuff to the wall it is. If wrapped in sometjing something agile, at least it looks good."
roguecoder,"on Oct 29, 2022","Trying to guess the future of complex systems is an exercise in hubris.Success is far more likely if you decide on a goal, and then build feedback loops that let you learn. And in the internet age a feedback loop of a month is painfully slow, never mind three."
ThalesX,"on Oct 30, 2022",Is that goal for next week? Two weeks? My argument was that three months is too little for any sort of company strategy. We’re talking about a financial quarter. You don’t even have the time to measure your decisions.
hef19898,"on Oct 29, 2022","Not everything is a consumer facing app, you know?"
SpicyLemonZest,"on Oct 29, 2022","I'm pretty skeptical of this kind of thing even for enterprise software. I can imagine scenarios where it's relevant - if you're planning to release Disney+ in 6 months, yeah, you'd better coordinate pretty tightly to make sure you're not missing some key dependency when you flip the switch. But I've seen multiple incredibly successful enterprise products developed through the ""throwing things to the wall and see what sticks"" approach."
kgwgk,"on Oct 29, 2022","""In preparing for battle I have always found that plans are useless, but planning is indispensable."""
ThalesX,"on Oct 30, 2022","> Just look back 3 month and assess how many of the things that happened were predictable (keeping in mind the fact that hindsight is 20/20).The company I work for hasn’t changed a single procedure or milestone. Neither have my clients. I am also not talking about predicting the world, but of predicting an internal kitchen.This is just n = 1 but I’ve never seen a company that does it’s strategic planning in detached 2 week sprints.If anything, if any sort of coherence exists I’d say that the previous sprint, the current sprint and the next sprint should have an understandable connection, and then we are already talking about a month and a half.> I wager every company in the world was affected by the world wide changes right now.Affected? Perhaps. Derailed? Not so much.> Those who cling to plans are at disadvantage against those who have the ability to quickly adapt to the change.Both have their advantages and disadvantages, but I’d trust and would like to work, more, for a company that doesn’t flap in the wind.No one in the industry expects stability like in the waterfall days, but to expect a company to change / adapt their strategy in less than a financial quarter is just marketingspeak in my opinion."
ethbr0,"on Oct 29, 2022",> Those who cling to plans are at disadvantage against those who have the ability to quickly adapt to the change.https://en.m.wikipedia.org/wiki/OODA_loop
doctor_eval,"on Oct 29, 2022","> The OODA loop has become an important concept in litigation,[2] business,[3] law enforcement,[4] and military strategy. According to Boyd, decision-making occurs in a recurring cycle of observe–orient–decide–act. An entity (whether an individual or an organization) that can process this cycle quickly, observing and reacting to unfolding events more rapidly than an opponent, can thereby ""get inside"" the opponent's decision cycle and gain the advantage."
sanderjd,"on Oct 30, 2022","""Somewhat predict"" is incredibly different than ""make a detailed plan for"". I like strategic planning in 3, 6, even 12 month increments, but doing the detailed work toward those high level plans in much shorter and less static increments."
ThalesX,"on Oct 30, 2022","Let’s assume you have a strategy for the next 3 months. You identified / endivisioned a need in the market and came up with a reasonable solution; you locked in the budget, you allocated the resources. How many times are you going to change these in the 3 months?"
sanderjd,"on Oct 30, 2022","But that's not the kind of plan that comes out of these planning sessions. What you're describing is more like the effort to put together organization / unit level OKRs. That is a good thing. But getting everyone together to guess ahead of time how they'll execute that solution in detail is a poor use of time in my opinion. I think the planning exercise is useful for cross organization alignment at a high level, but for individual contributors, I think it at best makes their eyes glaze over and at worst makes them frustrated and demoralized, and then once the planning is done everyone goes back to doing the actual work, which of course doesn't match the plan very closely."
cortesoft,"on Oct 29, 2022","If you have a company that has more than 200 developers, there is a certain level of inertia involved in everything you do. You can’t be shifting projects nearly as quickly as when you have 10-50 developers.Having worked at both very large and very small companies, people who have not worked in the other just don’t understand what it is like at the other scale."
Yizahi,"on Oct 29, 2022",For example the sort of business which supplies hardware needed to write yours or mine comment. Not everyone is deploying to production every day or even every two weeks. Not everyone has feature development measured in hours.
skeeter2020,"on Oct 29, 2022",">> I was blown away at how effective it was. Once a quarter, we had a 3-day event in which the entire next 3 months were planned outYep, you get this, a 13 week PLAN. Just adopting plan-old maligned waterfall can give you a plan lasting years! Unfortunately software development teams are supposed to deliver more than plans.You can totally do quarterly planning without SAFe, cross-team colaboration can be achieved, and having teams spend time digging into future work is immensly valuable. SAFe leeches from these positives without actually enhancing them, while adding an imense amount of overhead and real costs."
zogomoox,"on Oct 29, 2022","Even if it worked, who wants to be in a 3 day long planning meeting every quarter? It sounds like a worse kind of hell to me."
user_named,"on Oct 30, 2022","In our scrum process, I spend 6 days spread out over three months in sprint planning."
sanderjd,"on Oct 30, 2022","Yes, but quarterly planning does not preclude sprint planning... You do both."
config_yml,"on Oct 30, 2022","I’ve been there. A meeting with over 900 people, half of them in a different timezone, looped in via video feed on a big wall. Fortunately it was also my last meeting of such kind. The following 3 months were a total waste of time."
tsimionescu,"on Oct 29, 2022","What happened when two months in the priorities changed, or when a feature that looked like it might take a turned out to take a month?"
JamesSwift,"on Oct 29, 2022","Priorities changing is one thing, but the answer to the second one is that priorities are priorities. If something to the left-side of a timeline now takes longer, it usually shifts everything else to the right. Thats just the reality of the situation, and the point is to have the awareness of the impact and be able to adjust accordingly."
Yizahi,"on Oct 29, 2022","You change priorities then. If a set of features takes much longer due to whatever reason, you just pare them down  or postpone release accordingly. If you have important customers waiting for the release, you then first talk to them and then cut or postpone depending on their opinion and common sense. Delaying release doesn't summon demons or cause apocalypse, despite what some managers try to bs us."
sanderjd,"on Oct 30, 2022","I think maybe this is the confusing thing to me. What ""release""? It seems like plenty of people are doing this for service-oriented software where these ""releases"" are totally arbitrary. Most of us are not putting CDs in boxes..."
sanderjd,"on Oct 30, 2022","It's interesting to me that you saw this as such a success story. In my organization, people have worked hard to get it down well under three days, and to me it still feels like a ton of effort for dubious benefit, because no plan survives first contact with the enemy."
bl4ckm0r3,"on Oct 29, 2022","How big was the team and what type of project?
And what amount of level of detail did you put in the planning/roadmap?
Did you also had experiments and investigations taken into account?"
tapatio,"on Oct 29, 2022","Same. I found it to be very effective, especially having a bunch of release trains in sync. Obviously this applies to large organizations."
rootusrootus,"on Oct 29, 2022","It's difficult to really articulate just how much damage SAFe safe has done to our organization.  But senior management loves the waterfall planning and the finance guys love the level of detail they can stuff into their spreadsheets somewhere.That it cuts our actual development output by half or more is not relevant.  As long as we can churn out meaningless Jira tickets to describe all that we aren't really doing, management is happy.The important work still gets done, but it's off the books.  It would never survive PI planning."
63,"on Oct 29, 2022","As someone who just finished a week of 8 hour PI planning meetings with another week of the same starting Monday, I wholeheartedly agree. My experience of SAFe has been shorter term waterfall with a couple steps cut out. It's definitely better than waterfall and I'm grateful for that, but I wouldn't call it agile."
tootie,"on Oct 29, 2022","SAFe almost feels like a ploy lead by waterfallistas to sneak their agenda back into the mainstream and call it ""agile"" to fool everyone. It's a shame because there is room for a toolkit to help scale agile. There aren't great tools for managing dependencies between agile teams."
roguecoder,"on Oct 29, 2022","It follows the outline of taylorism, just one level up from the team: measure, control and manage."
brightball,"on Oct 30, 2022",A week? It’s supposed to 2 days. 2.5 if you are partially time shifted.
throwaway93494,"on Oct 30, 2022","I mentioned this in another reply, but it bears repeating. Our current PI planning is 2 weeks not counting the half day before in Pre-Planning for PI Planning.I sincerely wish that was a joke. It's a 4 hour team wide meeting to review all work items are ready to be planned during PI planning, as well for us to identify dependencies and schedule meetings with those dependencies. There isn't enough time to to that during the actual planning."
sas224dbm,"on Oct 29, 2022","I have been involved in 2 medium sized-ish (~300) software support projects for western-nation's land forces project that brought in SAFe with a fanfare. Lots of ($$) training, everybody gulping down the coolade etc etc. It started off OK, but as with most of these ideological methodologies, our projects' circumstances started to clash with the SAFe 'way'. Our customer was very fond of his existing rituals (meetings, committees, progress meetings etc), but we also folded in all the SAFe rituals too. It seemed we were in meetings too much of the time, and we did a poor job of convincing the customer to move wholesale to the SAFe way. In addition, the organizational structure and governance models never operated in the SAFe way, with the customer's insistence on being in our shorts on every decision hampered most of the 'delegate decisions as deep as possible' philosophy. At the end of the day, it steel feels like RUP re-invented for 'agile' .. never again."
flerchin,"on Oct 29, 2022","The thoughtworks case study is repeated. Otherwise wholeheartedly agree. I have delivered plenty of software during 10 PIs, but that was in-spite of SAFe, and the whole thing was harder and slower because of it.Since then, I reorganized a team of ninjas away from the trains and have delivered at 3x the velocity using kanban methodology."
lee,"on Oct 29, 2022","I worked for a company that adopted SAFe and sent me to get certified as a SAFe Program Consultant.  So I worked to set up ""Agile Release Trains"" and coached a few teams that had never used any Agile methodology before.I can absolutely understand the frustration that many have with SAFe, especially when it's pushed from a top-down manner.  However, It's not entirely terrible as it provides some tools that can be address some organizational problems.I think at best if a large organization is already doing well and is ""agile"" overall, SAFe won't provide a lot of value and is unlikely worth the investment.  If an org is highly siloed, dysfunctional, and lacking inter-department coordination then SAFe it at least offers some tools to address those issues."
tonyarkles,"on Oct 29, 2022","I have never worked in a SAFe environment, but have worked with multiple teams that have followed various Agile methodologies over the years, with varying degrees of ""compliance to the process"".> I can absolutely understand the frustration that many have with SAFe, especially when it's pushed from a top-down mannerThis is the wrinkle, and in my experience the #1 factor for whether or not any particular methodology is going to work within an organization: top-level buy-in. Before I got too jaded, I worked with and helped some teams that wanted to try bottom-up agile, and it would help the team get better, but if a layer or two up in the management chain still wants e.g. fixed timeline, fixed budget, fixed scope projects, you're going to run into impedance mismatches all over the place and lose most of the benefits in the medium term.This can also happen in the other direction. An organization I worked with adopted EOS on the business side of the company but didn't really roll it out on the engineering side, except for expecting everyone organization-wide to specify their quarterly goals. After setting those quarterly goals, the engineering teams would still get yanked around in multiple directions, being asked semi-randomly to work on things that had nothing to do with their quarterly goals and then at the end of each quarter everyone just scratched their heads and went ""why didn't we accomplish what we wanted to accomplish?""Maybe I'm jaded, but I've gotten to the point where I don't really care which methodology is used, but rather that everyone top-to-bottom is on-board with it and actually following it. If it's Scrum, management needs to 100% buy in to the idea that they're going to get releases at a constant cadence and that those releases will contain whatever was prioritized as the highest value, with lower value features potentially missing. If it's something more conventional/waterfall-esque, management needs to be on-board with the fact that there's going to be some very costly analysis up front (that must include engineering) and that changes to that plan are expensive and will cause the schedule to slip; engineering needs to be on-board with the fact that they will be expected to deliver everything according to the schedule they built. It doesn't matter nearly as much which approach everyone wants to take, just that everyone understands the tradeoffs with that approach and that everyone's going to follow it."
heisenbit,"on Oct 29, 2022",The critique by agile experts of SAFe would be more convincing if they had shown earlier how to scale up agile.While not a fan of SAFe or any agile cargo cult implementation there were a few things I liked about SAFe: Some acknowledgement of the role of planning which imho. is needed at that scale and some framework to handle architectural concerns.
kitsune_,"on Oct 29, 2022","Self-organization at scale: Teal / Holacracy / Sociocracy. In the case of holacracy: Imagine a world where your company, its rules and all its employees including the bosses are bound by a constitution [0].Or have a look at Coplien's Scrum patterns [1] patterns that do involve ""planning"", and that are also supplemented by his decade old organizational pattern work outside of just Scrum.[0] https://www.holacracy.org/constitution/5[1] http://scrumbook.org/ and https://sites.google.com/a/scrumplop.org/published-patterns/..."
kevinmchugh,"on Oct 30, 2022","The idea that you can scale agile is false. It's fake. Agile experts didn't say how to do it because it can't be done. They put everything they knew, as clearly as they could, in the manifesto. And then they described themselves. And almost all of them were consultants. They found that delivering software frequently to their customers worked better than any alternative.If you can do that, you can do agile. It doesn't matter if your customers are internal or external - internal might be better, because you can work with them more regularly."
ineptech,"on Oct 29, 2022","I don't really understand SAFe, but from the outside looking in, it seems like the answer to ""How close can we get to agile while still employing an army of Project Managers?""  Which is to say, not very."
